DATE + TIME,HOST ,EVENT NAME,DESCRIPTION,EVENT TYPE,URL LINK,RSVP,LOCATION,,,,,,,,,
13.00 - 18.00,TDW + Co + Stop At Nothing X IOCMP,A Gathering of the Relentless,"Stop At Nothing returns to Cannes connecting the next generation of global Asian creative talent (and allies) to empower one another for positive and meaningful progress in the advertising industry. We're bringing together a collection of thought leaders and executives across the music, entertainment and advertising industry to share what it means to lead with authentic perspectives. And how the unique differences within heritage and experience can be a driving force of innovation and creativity.",Panels,https://www.tdwandco.com/cannes-lions-2025,https://stopatnothingcannes2025.splashthat.com/,"Le Bayou
11 Rue Victor Cousin,
06400, Cannes        ",,,,,,,,,
13.00 - 19.00,Advertising Producers Association,The APA Villa Party,"This year, we have taken to the hills of Cannes the APA Pool Party in partnership with Peach for Cannes 2025! 🏝️ 
Join us for a day of Aperol Spritz, Rose, sizzling BBQ, and poolside vibes. 
Along with some amazing food and drinks, we will also have DJ from Amsterdam based audio post company, Amp.Amsterdam",Party,https://docs.google.com/forms/d/e/1FAIpQLSeUDcVoNd36UHvI48nXWWd3Mg5RGgULDq6eGEhx0GNKI4f7Ew/viewform,https://docs.google.com/forms/d/e/1FAIpQLSeUDcVoNd36UHvI48nXWWd3Mg5RGgULDq6eGEhx0GNKI4f7Ew/viewform,133 AVENUE DE LA GABELLE 06220,,,,,,,,,
13.05,Brand Innovators,Experiential Marketing Panel,"Judy Lee, Sr. Director, Global Brand Experiences, Pinterest

Moderated by: Dane Aloe, EVP Measurement & Strategy, Spiro",Panel,https://brand-innovators.com/events/marketing-leadership-summit-cannes-2025/,https://brand-innovators.com/events/marketing-leadership-summit-cannes-2025/,Showcase Stage,,,,,,,,,
13.15,Brand Innovators,Showing Up: Meeting Consumers Where They Are Panel,"Tara Loftis, Global President, Dermatological Skincare (Cetaphil, Differin, Alastin, Benzac), Galderma
Richard Nunn, CEO MileagePlus, United Airlines
Peggy Roe, Executive Vice President and Chief Customer Officer, Marriott International
Julie Yufe, SVP Marketing Vodka, Rum, Gin & Liqueurs, Diageo
Moderated by: Vlad Strelsov, Head of Revenue, Attain",Panel,https://brand-innovators.com/events/marketing-leadership-summit-cannes-2025/,https://brand-innovators.com/events/marketing-leadership-summit-cannes-2025/,Beach Stage,,,,,,,,,
13.30,Omnicom,The Age of Integration​,"As brands push for seamless, end-to-end models, integration is the promise. But in the pursuit of harmony, are we dulling the edge that leads to breakthrough thinking? In this candid session, Omnicom leaders from creative, media, and precision explore how the most effective models embrace tension, not erase it. Because when integration is built to provoke — not pacify — it unlocks the kind of collaboration that drives sharper ideas and stronger business results.​",Talk,https://cannes.omc.com/the-age-of-integration,https://cannes.omc.com/the-age-of-integration,"Omnicom Space, Prom. Robert Favre le Bret
Cannes",,,,,,,,,
13.30,Stagwell - SPORT BEACH,The Track is my Canvas and My Car is my Brush: The Art of Technology in F1,"Jess Giles, Managing Director, Media Experience Practice, Code and Theory, Don McGuire, CMO, Qualcomm & GEORGE RUSSELL, 3x Grand Prix Winner, Driving for Mercedes-AMG PETRONAS F1",Panel,https://www.sportbeach.com/schedule,https://www.sportbeach.com/schedule,"Mainstage, Sport Beach, La Plage Du Festival at 52 Bd de la Croisette",,,,,,,,,
13.30 - 13.45,TikTok,Monetizing Viral Moments,"TikTok is a key platform for brands to engage with film, TV, sports, and music, but some brands are going further, creating cultural moments. This session features a dynamic Q&A with Zuru founder Nick Mowbray on how to disrupt markets, foster experimentation, and harness TikTok's viral power to shape digital culture, forge lasting connections, and drive unprecedented growth.",Panel,https://tiktokatcannes.com/,https://tiktokatcannes.com/,"Carlton Hotel,  58 Bd de la Croisette Cs 40052, 06400",,,,,,,,,
13.30 - 13.50,Little Black Book,"Panel Presented By ICCO PR & UNDP: Agency, Opportunity and Hope, An Optimist View of the Climate","​​​The climate emergency represents the most urgent threat to humanity and to our plant, but at the same time, the crisis is an incredible opportunity to create a better tomorrow for all future generations. To reach that full potential we need to bring everyone on board and empower citizens across the world to be part of the solution, but for many years the “doom and gloom” narrative around the issue has created apathy. How can we as communicators, marketers and creatives change that narrative to positive hope filled one and help reach the momentum needed.",Panel,https://lbbonline.com/news/the-lbb-and-friends-beach-cannes-content-programme-2025,https://lbbonline.com/news/the-lbb-and-friends-beach-cannes-content-programme-2025," LBB Beach , 65 Bd de la Croisette, 06400 Cannes",,,,,,,,,"
"
13.30 - 14.00,The Female Quotient,Mark Makers on the Moment: The Story Behind the Storyteller,"We recognize CMOs as the dynamic engine of the marketing world, responsible for the brands and memorable moments that capture our attention. Their impact is undeniable, but what has influenced them? What pivotal moments have defined them? Bringing its new thought leadership series, Mark Makers on the Moment, to life for the first time, The New York Times sits down with accomplished CMOs for candid, one on one conversations to uncover the impactful stories that shaped the storyteller.",Conversations,https://events.thefemalequotient.com/canneslions25,https://events.thefemalequotient.com/canneslions25,"Hôtel Martinez – Suite 731
73 La Croisette
06400 Cannes",,,,,,,,,
13.30 - 14.10,Stop At Nothing X IOCMP,Why Authentic Representation On And Behind Camera Works,"We're bringing together a collection of thought leaders and executives across the music, entertainment and advertising industry to share what it means to lead with authentic perspectives. And how the unique differences within heritage and experience can be a driving force of innovation and creativity.",Talk,https://www.iocmp.org/stop-at-nothing,https://www.iocmp.org/stop-at-nothing,"Stop At Nothing Cafe @ Le Bayou, 11 Rue Victor Cousin, Cannes",,,,,,,,,
13.30-15.00,SoDA x Adobe,DEPT® Secret Garden: Creative at Speed,"Creative briefs aren’t what they used to be. AI is generating ideas, platforms are auto-building assets, and the once-clear lines between creative, media, and production? Long gone. Join us as we explore the seismic shift AI is making in how creative work actually gets done, with tangible advice from leading platforms and agencies.  

Stick around after the session to enjoy a drink and keep the conversation going. ",Panel Session + Drinks,https://www.deptagency.com/event/soda-dept-cannes-2025/,https://www.deptagency.com/event/soda-dept-cannes-2025/,"3 Rdpt Duboys d’Angers, 06400 Cannes",,,,,,,,,
13.45 - 14.15,TikTok,Beyond the Fine Print: Creators as Catalysts in Regulated Industries,"Even the most traditional industries, long bound by stringent regulations, can discover authentic connection on TikTok. This session, moderated by TikTok Canada GM Joshua Bloom in conversation with leaders from Suncorp and BMO, explores how heavily regulated brands are partnering with creators to drive trust, relevance, and tangible results.",Panel,https://tiktokatcannes.com/,https://tiktokatcannes.com/,"Carlton Hotel,  58 Bd de la Croisette Cs 40052, 06400",,,,,,,,,
13.45 - 14.30,Empower Café,It’s time to Reframe How Brands approach Responsible Marketing,"The current economic and political climate is prompting brand marketers to rethink their strategies. Join a panel of industry experts as they explore how brands can thrive and move forward in the most challenging environment of the past two decades. Hannah Mizra, Founder Responsible Marketing Advisory, Christina Tazza, Global Chief Strategy Officer, Design Bridge and Partners, Marisa Nelson, EVP, Marketing and Communications, Equativ & Vanessa Vidad, Inclusion Co-Lead, ISBA ",Panel,https://web-eur.cvent.com/event/16ed6ea2-c9d2-4327-9a66-8690baab3491/websitePage:faae80fb-70d8-4ffb-b597-52e912db01b6,https://web-eur.cvent.com/event/16ed6ea2-c9d2-4327-9a66-8690baab3491/websitePage:faae80fb-70d8-4ffb-b597-52e912db01b6,"L'Avenue 1-5 Sq. Mérimée, 06400 Cannes",,,,,,,,,
13.50,Brand Innovators,Own the Dream: Behind The Campaign,"Peter Giorgi, Senior Vice President, Brand Marketing, Partnerships and Creative Excellence, Rocket

John McKelvey, Co-Founder and CCO, Mirimar Creative Group

Moderated by: Alison Mayes, Managing Director, Apollo Partners",Panel,https://brand-innovators.com/events/marketing-leadership-summit-cannes-2025/,https://brand-innovators.com/events/marketing-leadership-summit-cannes-2025/,Beach Stage,,,,,,,,,
14.00 - 14.05,Transmission,Drinks & Networking and Opening Remarks,"Brand, AI and the Battle for the Mid-Funnel: Personalization, Precision and Buyer Trust",Drinks & Networking,https://app.boompop.com/events/RHFB9V/the-unofficial-home-for-b2b-at-cannes-lions-2025/guest-website,https://app.boompop.com/events/RHFB9V/the-unofficial-home-for-b2b-at-cannes-lions-2025/guest-website,"Le Speakeasy Cannes, 22 Rue Latour-Maubourg, 06400 Cannes",,,,,,,,,
14.00 - 14.20,Little Black Book,"Panel Presented By ICCO PR & AMEC: 2025 Measurement: Data, Trends, Updates and Impact","This panel will discuss the 2025 measurement trends, new Barcelona Principles 4.0 updates and channel implications of AI.",Panel,https://lbbonline.com/news/the-lbb-and-friends-beach-cannes-content-programme-2025,https://lbbonline.com/news/the-lbb-and-friends-beach-cannes-content-programme-2025," LBB Beach , 65 Bd de la Croisette, 06400 Cannes",,,,,,,,,"
"
14.00 - 14.30,Adform,A CMO’s Guide to Winning: Navigating Adtech’s New Rules,"As privacy regulations tighten and third-party cookies fade, European CMOs face growing pressure to deliver results while managing compliance and risk. This session explores the strategic tech choices brands must make—especially the potential risks of relying solely on U.S. platforms. With growing regulatory uncertainty, is it time to consider trusted European alternatives? Join us to uncover how smart, future-proof decisions can turn disruption into competitive advantage.",Panel,https://adformcannes2025.splashthat.com/,https://acmosguidetowinningnavigatinga.splashthat.com/,"RTL Beach, CBeach - 45 Boulevard de la Croisette",,,,,,,,,
14.00 - 14.30,Amazon,A seat at the table: The power of co-creation,"The boldest brands today don't just follow culture—they help create it. Authentic collaborations with talent and creators can lead brands to ideas that spark cultural movements, not just moments, driving buzz and business impact.",Talk,https://www.amazonadvertisingevents.com/amazonport2025/home,https://www.amazonadvertisingevents.com/amazonport2025/home,"Amazon Port - Plaza Stage
Esplanade Pantiero, Port de Cannes,
06400 Cannes",,,,,,,,,
14:00 - 14:45,Adweek,Group Chat Presented in Partnership With Pearpop,TBA,Chat,https://event.adweek.com/awh_cannes_2025/agenda,https://event.adweek.com/awh_cannes_2025/begin,"Le Majestic Hotel
10 Bd de la Croisette, 06400 Cannes",,,,,,,,,
14.00 - 14.45,VaynerX,Foodie Masterclass: Delicious Is Not Enough,"Diving Into Sensory Building
Join us for an insightful masterclass hosted with our food branding friends at Chuck Studios, where founder and creative director Olaf van Gerwen will explore how food brands can stand out beyond just deliciousness.
Looking delicious is essential for food and drink brands—but is it enough to stand out in your category? We’ll explore how brands are developing unique Culinary Identities and using food images to drive distinction.
One thing’s certain: food and drink brands will always showcase their products—so make your creative count!",Partnership Festival Experience / Official Events,https://events.vaynerx.com/foodiemasterclass,https://events.vaynerx.com/foodiemasterclass,"Chez Vayner Café, 2 Pl. du Général de Gaulle",,,,,,,,,
14.00 - 15.00,The SH COllective,Reinventing Influence: Gen Z is HERE,Redefining influencer marketing through authenticity and long-term relationships,Panel,https://www.saloncultureconversations.com/,https://www.saloncultureconversations.com/,"Salon Culture Conversations Villa
384 Boulevard des Glaïeuls
06220 Vallauris",,,,,,,,,
14.00 - 15.30,New Digital Age,The future of media owners,A roundtable discussing how media owners can survive and thrive in a fragmented digital world.,Roundtable,https://newdigitalage.co/cannes/cannes-2025-content-programme/,https://newdigitalage.co/cannes/cannes-2025-content-programme/,Maison NDA,,,,,,,,,
14.00 - 15.30,Financial Times,AI & Creativity: Transforming Advertising," Join us in-person at this insight-driven FT Session @ Cannes Lions to hear top advertising leaders and AI innovators share strategies, timelines, and emerging technologies that are redefining the future of marketing. Connect with leading AI pioneers and creative visionaries and gain the insights needed to keep your brand ahead in an AI-driven world.  ",Panel,https://ftsessioncannes.live.ft.com/agenda,https://event-registration.ft.com/register/f5968672-d465-4444-8954-96a1f987519c/account-details?utm_source=partner-website&utm_medium=display&utm_campaign=global_partner_event-registration_prospecting_apply-to-attend_2025-ft-session-cannes_partner,"Nikkei FT Anniversary Teahouse, 11 Rue Des Belges,
Cannes",,,,,,,,,
14.00 - 16.00,OnAudience,Sail the Big Data Yacht in Cannes,"Set sail for a one-of-a-kind networking experience that blend business insight with the serenity of the Mediterranean. Luxury Big Data Yacht (Beneteau First 53) provided by OnAudience offers a curated, intimate setting that inspires clarity, connection, and collaboration.",Networking,https://onaudience.com/big-data-yacht-in-cannes/,https://onaudience.com/big-data-yacht-in-cannes/,Luxury Big Data Yacht (Beneteau First 53),,,,,,,,,
14.00 - 16.00,ACT Responsible,OPEN HOUSE FOR GOOD,"Join us at the Open House for Good (OHFG!) a vibrant gathering at the Lions x ACT Sustainability Hub during Cannes Lions. This inspiring event brings together changemakers, creatives, and curious minds for meaningful conversations around one of the most pressing topics of our time: sustainability.
Organized by ACT Responsible and IAA Global, in partnership with Cannes Lions, OHFG! is more than just an event, it's a bold step toward making the Festival more inclusive, purposeful, and impactful.",Networking,https://www.eventbrite.com/e/open-house-for-good-2025-the-meeting-point-for-a-sustainable-industry-tickets-1299362892389?aff=erelpanelorg&keep_tld=1,https://www.eventbrite.com/e/open-house-for-good-2025-the-meeting-point-for-a-sustainable-industry-tickets-1299362892389?aff=erelpanelorg&keep_tld=1,"Théâtre Claude Debussy
1 Boulevard de la Croisette 06400 Cannes",,,,,,,,,
14.00 - 16.00,WPP and GroupM,Mainstage,"WPP and GroupM Future of Media Day - Engaging talks with industry leaders, driving innovation and change.",Talks,https://www.wppatcannes2025.com/event/b54177a9-d829-4222-b322-c6c5a9a592fe/groupm-at-cannes,https://www.wppatcannes2025.com/event/b54177a9-d829-4222-b322-c6c5a9a592fe/groupm-at-cannes,WPP Beach,,,,,,,,,
14.00 - 16.00,Common Interest,It's Only Entertainment,"Today, everything is entertainment. From simple behaviours like how we present ourselves online, to transformative practices like how news is delivered and elections are won. It’s how a launch campaign for a film can be a bigger spectacle than the film itself, or how an incongruous product collab can create demand from completely new audiences. This panel explores the exponential rise of everything as entertainment, and what this means for brands, talent and platforms, their narratives and the importance of ideas.
Baby Teeth are joined by: Zoe Clapp, Global Director for YouTube Shorts, Artist + GenAI Marketing, YouTube
Jamie Adair of creative collective Crowns and Owls

Panel starts at 2:30pm CET. No late admissions.",Panel,https://www.eventbrite.co.uk/e/its-only-entertainment-tickets-1389406334749,https://www.eventbrite.co.uk/e/its-only-entertainment-tickets-1389406334749,23 Avenue Florida 06400 Cannes ,,,,,,,,,
14.00 - 16.00, PMG,Alli Hours,"Drop in for a casual happy hour with the PMG team. Whether you’re curious about our technology, want a peek behind the curtain, or just need a break from the Croisette, Alli Hours are a chance to connect, recharge, and explore what we're building. ",Happy Hour,https://events.pmg.com/cannes-2025,https://events.pmg.com/cannes-2025,"Maison de PMG
11 Chem. Saint-Nicolas
Cannes,",,,,,,,,,
14.00 - 16.00,VaynerX,Private Shopping Experience,"A Luxury Surprise AwAIts
Step into a world where innovation meets elegance—surrounded by luxury, creators are invited to explore cutting-edge AI try-on technology while discovering curated looks tailored in real time. It’s a seamless fusion of fashion and future—designed for bold expression, effortless content, and unforgettable connections in the heart of Cannes",Partnership Festival Experience / Official Events,https://events.vaynerx.com/privateshoppingexperience,https://events.vaynerx.com/privateshoppingexperience,TBD,,,,,,,,,
14.00 - 17.00,LinkedIn,Creator Experience,"The LinkedIn Studio is the home for B2B thought leadership on the Croisette. Studio engagements will encourage top customers, influencers and members to record and post short-form videos to LinkedIn, enabled with onsite consultations and thematic prompts. In partnership with Adobe editing experience",Activity,https://linkedinatcanneslions2025.splashthat.com/,https://linkedinatcanneslions2025.splashthat.com/,"LinkedIn Studio,  Carlton Cannes, 
58 Boulevard De La Croisette ",,,,,,,,,
14:00 - 19:00,Captify,"Meet, Greet, Pool, Repeat!","Step away from the frenzy of the Croisette and join fellow industry leaders for a refined afternoon of sun, sound and connection – at the iconic Captify villa in Mougins. Think signature cocktails, curated canapés, and a live DJ… all served up beside the largest private pool on the Côte d’Azur. Remember to come swim-ready if you plan to take a dip!",Social,https://www3.captifytechnologies.com/meet-greet-pool-repeat?utm_campaign=94525631-Cannes%20Meet%20Greet%20Pool%20Repeat%202025&utm_source=propellergroup&utm_medium=referral,https://www3.captifytechnologies.com/meet-greet-pool-repeat?utm_campaign=94525631-Cannes%20Meet%20Greet%20Pool%20Repeat%202025&utm_source=propellergroup&utm_medium=referral,"Villa Rochelle, 562 bis Chem. de Bigaud, 06250 Mougins",,,,,,,,,
14.05 - 15.05,Transmission,CMO Masterclass: Supercharge Your Brand with Behavioral Science,"Understanding how B2B buyers truly behave—beyond what they claim—can be challenging yet transformative. This hands-on workshop dives into over 130 years of behavioral science research to help you craft more competitive brands, develop impactful products, and enhance communication strategies.",Workshop,https://app.boompop.com/events/RHFB9V/the-unofficial-home-for-b2b-at-cannes-lions-2025/guest-website,https://app.boompop.com/events/RHFB9V/the-unofficial-home-for-b2b-at-cannes-lions-2025/guest-website,"Le Speakeasy Cannes, 22 Rue Latour-Maubourg, 06400 Cannes",,,,,,,,,
14.10 - 14.40,Deep Blue Sports + Entertainment ,Women's Sports Yacht Club,"Building Legacy l A Fireside Chat with Emma Hayes

Emma Hayes, Head Coach, USWNT 
Laura Correnti, Founder & CEO Deep Blue Sports + Entertainment (Moderator)",Fireside Chat,https://wednesdayatthewsyc.splashthat.com/,https://wednesdayatthewsyc.splashthat.com/,"Maëma Beach
26 Boulevard Jean Hibert Azur Plage, 06400 Cannes",,,,,,,,,
14.15,Brand Innovators,Fireside Chat,"Neil Shah, Global Brand Director, Whiskey Portfolio

John Williams, Global Head of Scotch Brands, Diageo

Moderated by: Mitch Cristol, Vice President, Practice Leader (Beverages), InMarket",Fireside Chat,https://brand-innovators.com/events/marketing-leadership-summit-cannes-2025/,https://brand-innovators.com/events/marketing-leadership-summit-cannes-2025/,Beach Stage,,,,,,,,,
14.30,Brand Innovators,Fireside Chat,"Varun Vashist, Head of Marketing Technology Portfolio, Sky

Moderated by: Simon Thorne, Managing Director, EMEA, Innovid",Fireside Chat,https://brand-innovators.com/events/marketing-leadership-summit-cannes-2025/,https://brand-innovators.com/events/marketing-leadership-summit-cannes-2025/,Showcase Stage,,,,,,,,,
14.30,Omnicom,Every Dream Needs a Team,"High-performance teams aren’t just built on talent—they’re driven by creativity. In this dynamic session, Mercedes F1 driver George Russell shares what elite racing can teach us about solving problems under pressure, building trust, and organizing for speed. From pit stops to pitch rooms, we’ll explore how creative thinking, clarity of roles, and strong culture come together to drive results. Because when the goal is bold, the team behind it matters even more.​",Talk,https://cannes.omc.com/every-team-needs-a-dream,https://cannes.omc.com/every-team-needs-a-dream,"Omnicom Space, Prom. Robert Favre le Bret
Cannes",,,,,,,,,
14.30 - 14.50,Little Black Book,Panel Presented By ICCO PR & FIBEP: Driving Measurable Impact in Media Intelligence & PR,"The discussion is centered on FIBEP’s three core pillars: promoting fair and ethical use of publicly available news and media; driving technological innovation in AI, automation, and data analytics; and fostering a centralized, global forum for collaboration and shared knowledge. Attendees gain insight into how these efforts support measurable impact of PR in earned media, reinforce compliance and innovation, and strengthen industry-wide value creation.",Panel,https://lbbonline.com/news/the-lbb-and-friends-beach-cannes-content-programme-2025,https://lbbonline.com/news/the-lbb-and-friends-beach-cannes-content-programme-2025," LBB Beach , 65 Bd de la Croisette, 06400 Cannes",,,,,,,,,"
"
14.30 - 15.00,The Female Quotient,Passion Play: Scoring Big with Sports Communities,"Fan communities, fueled by a passion for their sports teams, offer brands a unique chance to transcend general sponsorships. This panel welcomes leaders to unpack how they are crafting immersive experiences to ignite genuine connections that leverage the raw emotional power of sports and forge lasting relationships that resonate far beyond the final whistle.",Panel,https://events.thefemalequotient.com/canneslions25,https://events.thefemalequotient.com/canneslions25,"Hôtel Martinez – Suite 731
73 La Croisette
06400 Cannes",,,,,,,,,
14.30 - 15.00,Adweek,ADWEEK House Programming,TBA,TBA,https://event.adweek.com/awh_cannes_2025/agenda,https://event.adweek.com/awh_cannes_2025/agenda,"Le Majestic Hotel
10 Bd de la Croisette, 06400 Cannes",,,,,,,,,
14.30 - 15.15,Empower Café,"#ChangeTheStats: Authentic Representation = Brand Power, (Not Just Good Intentions)","Authentic representation isn’t just a moral win—it’s a brand superpower. This #ChangeTheStats session explores how moving beyond tokenism builds deeper trust, drives relevance, and fuels long-term growth. Real inclusion means real impact—and consumers can tell the difference.
Chloë Davies, Founder & CEO, It Takes A Village Collective, Naomi Walkland, CMO, Motorway, Elly l'Anson, Head of the Unstereotype Alliance Secretariat (Interim) UN Women & Samuel Monnie, Purpose Hive 
ex P&G ",Panel,https://web-eur.cvent.com/event/16ed6ea2-c9d2-4327-9a66-8690baab3491/websitePage:faae80fb-70d8-4ffb-b597-52e912db01b6,https://web-eur.cvent.com/event/16ed6ea2-c9d2-4327-9a66-8690baab3491/websitePage:faae80fb-70d8-4ffb-b597-52e912db01b6,"L'Avenue 1-5 Sq. Mérimée, 06400 Cannes",,,,,,,,,
14.30 - 15.15,The Wall Street Journal,"Journal House Cannes - Building on a Powerful Base: How Amazon Business Created its Distinct Identity, sponsored by Amazon Business ","Registration opens 14.00. After checking in at Journal House, feel free to settle in, enjoy a beverage, and find a seat. 14.45 - Applying key consumer marketing principles can drive B2B growth among an enterprise audience, but there are also crucial lessons consumer-focused businesses can take from B2B brands' go-to-market strategies. In this conversation, we'll explore when to lean on established brand equity to strengthen customer trust - and when to draw away.  After the program, we invite you to enjoy your home away from home. Unwind with a coffee, connect with peers, and catch up on work.",Conversation,https://journalhouse.wsj.com/cannes-lions-festival-of-creativity/,https://journalhouse.wsj.com/cannes-lions-festival-of-creativity/,"61 Bd de la Croisette
Cannes",,,,,,,,,
14.30 - 18.00,Darkroom,"Cannes Confidential at Darkroom House with Oren, Ashwinn, Lucas, FERMÀT, PrescientAI, ReachFaster & Sotto",​Darkroom’s first rendition of Darkroom House brings together entrepreneurs and modern market makers for a brand strategy session in the French Riviera.,Various,https://lu.ma/bvx2kglj,https://lu.ma/bvx2kglj,"3155 Bd des Horizons
06220 Vallauris,",,,,,,,,,
14.40,Brand Innovators,Fireside Chat,"Angela Courtin, Vice President, YouTube Marketing Global Head of Brand, Creative, Culture and Media, YouTube

Moderated by: Carly Goodwin, Industry Director , Reddit",Fireside Chat,https://brand-innovators.com/events/marketing-leadership-summit-cannes-2025/,https://brand-innovators.com/events/marketing-leadership-summit-cannes-2025/,Beach Stage,,,,,,,,,
