DATE + TIME,HOST ,EVENT NAME,DESCRIPTION,EVENT TYPE,URL LINK,RSVP,LOCATION,,,,,,,,,
15.30 - 15.45,TikTok,Tools for a New Creative System,"Building on the conversation around reimagining the creative system, this demo shows how TikTok’s AI tools help you augment and automate key parts of the process. We’ll walk through real examples of how Symphony, creative insights, and audience signals can help you go from idea to content more easily. You’ll see how AI can support your team at every step, making it easier to create.",Presentation,https://tiktokatcannes.com/,https://tiktokatcannes.com/,"Carlton Hotel,  58 Bd de la Croisette Cs 40052, 06400",,,,,,,,,
15.30 - 16.00,The Female Quotient,Mentorship Matters: Paying It Forward in Leadership,"Great leaders don’t just build careers—they build people. This discussion highlights male executives who have made mentorship a priority, sharing personal stories of guidance, career-defining moments, and the long-term impact of investing in the next generation of professionals.",Discussion,https://events.thefemalequotient.com/canneslions25,https://events.thefemalequotient.com/canneslions25,"Hôtel Martinez – Suite 731
73 La Croisette
06400 Cannes",,,,,,,,,
15:30 - 16:00,Adweek,ADWEEK House Programming,TBA,Programming,https://event.adweek.com/awh_cannes_2025/agenda,https://event.adweek.com/awh_cannes_2025/begin,"Le Majestic Hotel
10 Bd de la Croisette, 06400 Cannes",,,,,,,,,
15.30 - 16.00,The Washington Post,An Industry First: Brand Studios Unite to Drive Change,"Vida Cornelious, SVP, Creative & Strategy,
The New York Times, Gemma Floyd, Global Head of Advertising Sales, The Washington Post & Michelle Hillman, Chief Campaign Development Officer, Ad Council",Panel,https://wpcannes2025.splashthat.com/,https://wpcannes2025.splashthat.com/,"The Washington Pst Lounge,  29 rue du Commandant André, Cannes",,,,,,,,,
15.30 - 16.00,Transmission,The New B2B Buyer: How New Media Consumption Habits Increase the Importance of Brand,"Today’s B2B buyers are not who they used to be. As younger, digital-native decision-makers enter the market in force, their expectations, motivations, and behaviors are fundamentally shifting. These audiences are sceptical of corporate jargon, fluent in digital self-research, and influenced more by what brands stand for than what they sell. As their journeys become more self-directed and nonlinear, brand storytelling and behavioural biases have never been more critical — not just to create awareness, but to consistently earn trust across every touchpoint.",Panel,https://app.boompop.com/events/RHFB9V/the-unofficial-home-for-b2b-at-cannes-lions-2025/guest-website,https://app.boompop.com/events/RHFB9V/the-unofficial-home-for-b2b-at-cannes-lions-2025/guest-website,"Le Speakeasy Cannes, 22 Rue Latour-Maubourg, 06400 Cannes",,,,,,,,,
15.30 - 16.00,Brand Innovators,Connecting Culture to Commerce: How Relevance Drives Revenue,"Eva Fischner, VP, Global Brand Content, American Express
Tara Loftis, Global President, Dermatological Skincare, Galderma
Emily O’Hara, VP, Global Head of Brand & Media, eBay
Moderated by: Jeff Greenspoon, Global Chief Client Officer, dentsu",Panel,https://brand-innovators.com/events/marketing-leadership-summit-cannes-2025/,https://brand-innovators.com/events/marketing-leadership-summit-cannes-2025/,Beach Stage  ,,,,,,,,,
15.30 - 16.15,Little Black Book,"LBB Presents: In a Future of AI Agents, How Do Brands Advertise Differently?",TBA,,https://lbbonline.com/news/the-lbb-and-friends-beach-cannes-content-programme-2025,https://lbbonline.com/news/the-lbb-and-friends-beach-cannes-content-programme-2025," LBB Beach , 65 Bd de la Croisette, 06400 Cannes",,,,,,,,,"
"
15.30 - 16.15,Empower Café,"Experience Is Everything: Reimagining Creativity, Leadership & Culture","From the frontlines of global culture to the beating heart of creative disruption, this powerhouse panel unites fearless female leaders who are rewriting the rules of experience. Through bold storytelling, unapologetic leadership, and a refusal to play it safe, they’ll explore how representation, risk, and cultural fluency are reshaping the creative landscape—from boardrooms to backrooms, brands to street corners. Expect sharp insights, real talk and truly inspiratonal learnings from some of the best in the business of experience.",Panel,https://web-eur.cvent.com/event/16ed6ea2-c9d2-4327-9a66-8690baab3491/websitePage:faae80fb-70d8-4ffb-b597-52e912db01b6,https://web-eur.cvent.com/event/16ed6ea2-c9d2-4327-9a66-8690baab3491/websitePage:faae80fb-70d8-4ffb-b597-52e912db01b6,"L'Avenue 1-5 Sq. Mérimée, 06400 Cannes",,,,,,,,,
15.30 - 17.00,Axios,Axios Live ,"Comfort Amid the Chaos: How Brands Become A Uniting Force: In moments of uncertainty, consumers turn to connection, familiarity, and meaning. Today’s leading communicators and marketers aren’t just selling products—they’re building a trusted community through nostalgia-driven campaigns, fandoms, experiential opportunities and more.",Conversations,https://comfortamidthechaosunitedbrand.splashthat.com/,https://comfortamidthechaosunitedbrand.splashthat.com/,"Axios at Fervor

5 Rue des Frères Casanova, 06400",,,,,,,,,
15.30 - 17.00,New Digital Age,NDA CTV/online video Roundtable,This roundtable will discuss the biggest opportunities and challenges in online video and CTV.,Roundtable,https://newdigitalage.co/cannes/cannes-2025-content-programme/,https://newdigitalage.co/cannes/cannes-2025-content-programme/,Maison NDA,,,,,,,,,
15.30 - 17.30,Yahoo,Yahoo alumni happy hour,Ever worked at Yahoo? Bring your best yodel and join us for an exclusive alumni happy hour to celebrate 30 years online.  Open to Yahoo alumni only,Happy Hour,https://www.yahooinc.com/events,https://motelyahoocannes2025.splashthat.com/,"Motel Yahoo, Martinez Beach, 73 Boulevard de la Croisette, 06400 Cannes,",,,,,,,,,
16.00,Omnicom in partnership with Spotify,"Streaming Smarter: 

Where AI Meets Human Storytelling​","What happens when AI meets artistry? In this session, Spotify’s Kay Hsu, AI DJ Xavier “X” Jernigan, and an Rohan Tambyraja executive unpack how AI is amplifying creative expression — from personalized playlists to real-time brand storytelling. Far from replacing the human touch, AI is helping creators and advertisers forge deeper, more meaningful connections. We’ll explore new tools from Spotify that make AI a powerful canvas for storytelling — and what that means for the future of branded content.​",Talk,https://cannes.omc.com/where-ai-meets-human-storytelling,https://cannes.omc.com/where-ai-meets-human-storytelling,"Omnicom Space, Prom. Robert Favre le Bret
Cannes",,,,,,,,,
16.00 - 16.20,Medialink Live,Fireside Chat with United Talent Agency's New CEO David Kramer,"In a world where culture moves at lightning speed and the lines between entertainment, sports, music, creators, and brands are increasingly blurred, staying relevant requires new strategies. Join United Talent Agency CEO David Kramer and Financial Times Global Media Editor Daniel Thomas for a candid chat about how UTA is helping brands navigate this evolving landscape. They'll explore the shifting definition of ""talent,"" the power of original and bold storytelling, and how brands can authentically connect with audiences by embedding themselves in culture. From creator partnerships to content strategies, this session will reveal how CMOs can drive long-term brand equity by collaborating with talent in smarter, more meaningful ways.",Fireside Chat,https://medialinkbeach.com/,https://medialinkbeach.com/,"Checkpoint 3, Palais des Festivals La Croisette, Cannes",,,,,,,,,
16.00 - 16.30,The Female Quotient,CMO Daily Take by The FQ and Business Insider: The Attention Recession,"The fight for consumer focus is fiercer than ever. People are bombarded with content, yet their attention is fleeting. What actually breaks through? And how can brands rethink engagement in a world of infinite distractions? Join marketing leaders for a conversation on how traditional engagement metrics aren’t the best indicators for engagement and what lessons can be learned from the creator economy and the opportunities immersive media and technology represent.",Conversation,https://events.thefemalequotient.com/canneslions25,https://events.thefemalequotient.com/canneslions25,"Hôtel Martinez – Suite 731
73 La Croisette
06400 Cannes",,,,,,,,,
16.00 - 16.30,Transmission,Transforming B2B Marketing: Leveraging Brand Storytelling & Entertainment to Capture Audience Attention,"This session will highlight the role of storytelling in entertainment to craft strong, memorable brands that resonate with audiences and influence their choices. Moderator(s):
Kimeko McCoy, Senior Reporter, Digiday. Speaker(s): Madeline Guppy, Founder, Guppy, Heather Barrett, Senior Director, Strategy & Planning, Transmission. Additional speakers TBC
",Panel,https://app.boompop.com/events/RHFB9V/the-unofficial-home-for-b2b-at-cannes-lions-2025/guest-website,https://app.boompop.com/events/RHFB9V/the-unofficial-home-for-b2b-at-cannes-lions-2025/guest-website,"Le Speakeasy Cannes, 22 Rue Latour-Maubourg, 06400 Cannes",,,,,,,,,
16.00 - 16.30,Adweek,Women Rewriting the Playbook in Sports Marketing,"Women in sports marketing are redefining the industry—both on and off the field. This panel features four pioneering women who lead in a traditionally male-dominated industry. Their collective experience spans a wide range of sports, showcasing diverse strategies that reflect both evolving fan behavior and an inclusive vision for sports marketing. Chief Marketers across the NFL, NHL, National Women's Soccer League, and LIV Golf share their journeys, challenges, and triumphs, revealing how they’ve reshaped the marketing landscape in sports. These women are at the forefront of making sports more inclusive, diverse, and innovative.",Talk,https://event.adweek.com/awh_cannes_2025/agenda,https://event.adweek.com/awh_cannes_2025/begin,"Le Majestic Hotel
10 Bd de la Croisette, 06400 Cannes",,,,,,,,,
16.00 - 16.30,Deep Blue Sports + Entertainment ,Women's Sports Yacht Club,"Exclusive Sneak Peek of ""Fastest Six Weeks in Sports"" followed by Q&A 

Kate Schoff, Managing Director, Sports & Entertainment Marketing, JPMorganChase
Jess Fair, Sr. Director, Integrated Customer Experience, The J.M. Smucker Co.
Ian Schafer, President & Co-Founder, Ensemble
Jonathan Schaerf, VP, Content Strategy & Partnerships, Religion of Sports
Laura Correnti, Founder & CEO, Deep Blue Sports + Entertainment
Julia Boorstin, Sr. Media & Tech Correspondent, CNBC (Moderator)",Panel,https://mondayatthewsyc.splashthat.com/,https://mondayatthewsyc.splashthat.com/,"Maëma Beach
26 Boulevard Jean Hibert Azur Plage, 06400 Cannes",,,,,,,,,
16.00 - 17.00,Brands&Culture,TACKLING TABOOS AND BREAKING DOWN BARRIERS,TBA,Talk,https://brandsnculture.com/cannes/,https://brandsnculture.com/cannes/,"Brands&Culture  VILLA, 13 Avenue de Benefiat, 06400",,,,,,,,,
16.00 - 17.00,The SH COllective,Women Entrepreneurs Driving AI Startups,"This inspiring panel highlights women founders transforming the AI startup space. Featuring Carolyn Pitts, Esq, CEO of Productions.com, the conversation focuses on navigating funding, scaling AI products, and leading with purpose in a male-dominated industry. Learn what it takes to drive meaningful innovation from the ground up.
",Panel,https://www.saloncultureconversations.com/,https://www.saloncultureconversations.com/,"Salon Culture Conversations Villa
384 Boulevard des Glaïeuls
06220 Vallauris",,,,,,,,,
16.00 - 17.30,VaynerX,Wine & What’s Next,"C-Suite Kickoff at the Tubi Cabana - Uncork the future of streaming with an intimate C-Suite gathering at the Tubi Cabana, featuring Tubi CEO, Anjali Sud and VaynerMedia CEO, Gary Vaynerchuk. Over a bespoke wine and cheese tasting, we'll explore what's next in streaming, brand storytelling, and audience engagement—with space for candid conversations, fresh perspectives, and meaningful connections.",Kick-off,https://events.vaynerx.com/winewhatsnextcannesedition,https://events.vaynerx.com/winewhatsnextcannesedition,"Tubi Cabana - Checkpoint Entry #3, Palais Des Festivals, La Croisette",,,,,,,,,
16.00 - 17.30,Uber Advertising,From Bondi to the Big Time: Exporting Creativity from the Edge of the World,"Australasia punches well above its weight when it comes to creativity, innovation and cultural influence. Hosted by B&T, this lively session brings together leading marketers and creative minds from the region to examine how to make ideas that can really travel, from ad campaigns to world-beating products. Expect bold opinions, big laughs and a few war stories from Cannes and beyond.
Speakers:Michael Levine, ANZ Country Head, Uber Advertising, Lucinda Barlow, Senior Director International, Marketing, Uber, Cat van der Werff, Executive Creative Director, Canva, Andy Fergusson, Chief Creative Officer, Leo Burnett, Tom Fogden, Editor, B&T (Moderator)",Panel,https://uberatcannes2025.splashthat.com/?uclick_id=c28104e7-0d9c-40aa-9fee-e128dbbaed60,https://docs.google.com/forms/d/e/1FAIpQLSfxz8tK8atNXzTeeBBXXPH9uFvu0fnyGoRe91xowJYEUX7F2w/viewform,"Uber Villa, 10 Rue Jean-Baptiste Dumas",,,,,,,,,
16.00 - 18.00,3C Ventures,Happy Hour,Join us for daily “Sunset Sips” hosted by Zeta Global,Happy Hour,https://plage3cv.com/,https://plage3cv.com/,"Lucia Beach Bd de la Croisette, Cannes, France 06400",,,,,,,,,
16.00 - 18.00,Kantar,The future of Creator Marketing: Enhancing creative impact with AI,"Creators are revolutionising the marketing ecosystem, driving major results for brands, and flipping conventional advertising wisdom on its head. But marketers have been trying to crack the creator nut since the dawn of this new medium. Now, thanks to AI, marketers can better understand how to maximize creative impact with creators and optimize marketing outcomes. Join Kantar, Whalar, Coke, and a surprise guest as we unpack the future landscape of creator marketing and the pivotal role AI will play in shaping it.",Conversations,https://www3.kantar.com/cannes-lions-2025/,https://www3.kantar.com/cannes-lions-2025/,"The Kantar Apartment
Rue de Serbes, 13
5th and 6th floor
Cannes",,,,,,,,,
16.00 - 18.00,InMobi,"
Happy Hour","Join InMobi for a Happy Hour filled with great drinks, good vibes, and even better conversations. Come connect, unwind, and network!",Happy Hour,https://go.inmobi.com/inmobi-cannes-lions-2025/,https://go.inmobi.com/inmobi-cannes-lions-2025/,"La Cantina, 41 Rue Hoche, Cannes",,,,,,,,,
16.00 - 18.00,Little Black Book,Happy Hour Sponsored by Clear Channel,TBA,Happy Hour,https://lbbonline.com/news/the-lbb-and-friends-beach-cannes-content-programme-2025,https://lbbonline.com/news/the-lbb-and-friends-beach-cannes-content-programme-2025," LBB Beach , 65 Bd de la Croisette, 06400 Cannes",,,,,,,,,"
"
16.00 - 18.00,Amazon,Happy Hour,Happy Hour,Happy Hour,https://www.amazonadvertisingevents.com/amazonport2025/home,https://www.amazonadvertisingevents.com/amazonport2025/home,"Amazon Port - Cafe 
Esplanade Pantiero, Port de Cannes,
06400 Cannes",,,,,,,,,
16.00 - 18.00,Wurl (an AppLovin company),Wurl Mixer & Social Hour,"Wurl Mixer & Social Hour - Open to all, stop by the cabana!",Networking,https://events.wurl.com/wurl-at-cannes-lions-2027,https://events.wurl.com/wurl-at-cannes-lions-2027,Wurl Cabana - Cabana #16 Checkpoint Entry #3,,,,,,,,,
16.00 - 18.30,Kantar,Nordic kick-off: Mastering TV Ad effectiveness,"Join Kantar, Marketing Finland, and Sveriges Annonsörer for an inspiring and relaxed networking session, where creativity meets science. At this exclusive meet-up, we’ll share fresh insights from a new collaboration between Kantar, MTV, and TV4. Together, we reveal the creative elements that truly drive TV ad performance across the Nordics. We’re also thrilled to welcome Myralda Derks, Chief Customer & Business Intelligence Officer at L'Oréal. She will share how L'Oréal balances creative effectiveness with the evolving role of new media channels.",Conversations,https://www3.kantar.com/cannes-lions-2025/,https://www3.kantar.com/cannes-lions-2025/,"The Kantar Apartment
Rue de Serbes, 13
5th and 6th floor
Cannes",,,,,,,,,
16.00 - 19.00,Human + Seedtag,A Collective Apéro,"The week begins here. Join Seedtag and HUMAN for a welcome happy hour at The Haven—the oasis for humanity. Whether you're meeting new faces or reuniting with familiar ones, this happy hour is a chance to come together, share a drink, and set the tone for the days ahead.",Happy Hour,https://acollectiveaperohuman.splashthat.com/,https://acollectiveaperohuman.splashthat.com/,"The Haven by HUMAN
2 Rue des Serbes",,,,,,,,,
16.05 - 16.30,Brand Innovators,Fireside Chat,"Javier Meza, President, Marketing & Europe CMO, The Coca-Cola Company

Moderated by: Michele Fisher, Global Director, Strategy, Microsoft",Fireside Chat,https://brand-innovators.com/events/marketing-leadership-summit-cannes-2025/,https://brand-innovators.com/events/marketing-leadership-summit-cannes-2025/,Beach Stage  ,,,,,,,,,
16.15 - 16.30,TikTok,Drive Consideration and Conversions with TikTok Market Scope,"TikTok Market Scope, a brand-new analytics platform, takes consideration and conversion to a new level. At this can’t-miss demo, learn how this new offering enables brands to better understand their audiences on TikTok, which have the highest consideration for your brand, and how to inspire them to turn intent into action.",Demo,https://tiktokatcannes.com/,https://tiktokatcannes.com/,"Carlton Hotel,  58 Bd de la Croisette Cs 40052, 06400",,,,,,,,,
16.15 - 17.00,Empower Café,"#ChangeTheStats Conversation: How Gender Balance Leadership Isn't ""Woke"" – It's Winning.","Hosted by WACL, this conversation dives into why gender-balanced leadership isn’t about ticking boxes—it’s a business imperative. Hear from industry leaders driving change, proving that equality powers stronger teams, smarter decisions, and better outcomes across the board.",Panel,https://web-eur.cvent.com/event/16ed6ea2-c9d2-4327-9a66-8690baab3491/websitePage:faae80fb-70d8-4ffb-b597-52e912db01b6,https://web-eur.cvent.com/event/16ed6ea2-c9d2-4327-9a66-8690baab3491/websitePage:faae80fb-70d8-4ffb-b597-52e912db01b6,"L'Avenue 1-5 Sq. Mérimée, 06400 Cannes",,,,,,,,,
16.20 - 17.00,Medialink Live,"MediaLink Live: Game On 
The Power Play Combo of Sports + Brands"," What happens when elite athletes and visionary marketers team up? In this dynamic conversation, Draymond Green (Golden State Warriors), Aaron Gordon (Denver Nuggets), and Virgil van Dijk (Liverpool FC) join Paulie Dery, CMO of AG1, for a conversation moderated by Fara Leff, COO of Klutch Sports Group. Together, they'll explore the evolving intersection of global sport, personal branding, and business—on and off the field. From building influence to navigating partnerships, these leaders share how they're creating lasting impact beyond the game. With AG1's role in the wellness space as a backdrop, the session offers a candid look at how athletes maintain performance, build their brands, and expand their reach across industries. Whether it's a product, a platform, or a personal mission—this is where sports and brand strategy collide.
























",Conversation,https://medialinkbeach.com/,https://medialinkbeach.com/,"Checkpoint 3, Palais des Festivals La Croisette, Cannes",,,,,,,,,
16.30,Stagwell - SPORT BEACH,Drinks with SeeHer in Sports,SeeHer in Sports,Drinks Event,https://www.sportbeach.com/schedule,https://www.sportbeach.com/schedule,"A Deck, Sport Beach, La Plage Du Festival at 52 Bd de la Croisette",,,,,,,,,
16.30,Stagwell - SPORT BEACH,SPORT BEACH Open Play,Hosted by Double Verify,Activity,https://www.sportbeach.com/schedule,https://www.sportbeach.com/schedule,"Main Court, Sport Beach, La Plage Du Festival at 52 Bd de la Croisette",,,,,,,,,
16.30,Brand Innovators,Facing Fragmentation: Innovating When The Audience is Everywhere,"Nancy Hall, North America CEO, Mindshare
Mike Law, CEO, Carat North America
Peggy McCann, Chief Marketing Officer, GSD&M
Erin Quintana, US CEO, UM
Shelby Saville, CEO, Starcom US
Moderated by: Dave Hollander, Vice President of Sales, adMarketplace",Panel,https://brand-innovators.com/events/marketing-leadership-summit-cannes-2025/,https://brand-innovators.com/events/marketing-leadership-summit-cannes-2025/,Beach Stage  ,,,,,,,,,
16:30 - 17:00,Adweek,ADWEEK House Programming,TBA,Programming,https://event.adweek.com/awh_cannes_2025/agenda,https://event.adweek.com/awh_cannes_2025/begin,"Le Majestic Hotel
10 Bd de la Croisette, 06400 Cannes",,,,,,,,,
16.30 - 17.00,TikTok,Unlocking Commerce through Creativity,"Creativity fuels conversion. Discover how brands and creators are designing new shoppable experiences that feel native, narrative-driven, and impossible to scroll past. As TikTok Shop and our ad solutions grow, it’s not just about transactions—it’s about trust.",Panel,https://tiktokatcannes.com/,https://tiktokatcannes.com/,"Carlton Hotel,  58 Bd de la Croisette Cs 40052, 06400",,,,,,,,,
16.30 - 17.00,The Washington Post,Washington Post Trivia,"Drew Goins, Co-Host of “Impromptu” and Newsletter Writer, The Washington Post
Dave Jorgenson, Senior Video Reporter, host and producer ‘Local News International’, The Washington Post",Panel,https://wpcannes2025.splashthat.com/,https://wpcannes2025.splashthat.com/,"The Washington Pst Lounge,  29 rue du Commandant André, Cannes",,,,,,,,,
16.30 - 17.15,Little Black Book,Panel presented by IAPI: 'Ireland's Global Marketing Impact: Driving Success at Home and Abroad',TBA,,https://lbbonline.com/news/the-lbb-and-friends-beach-cannes-content-programme-2025,https://lbbonline.com/news/the-lbb-and-friends-beach-cannes-content-programme-2025," LBB Beach , 65 Bd de la Croisette, 06400 Cannes",,,,,,,,,"
"
16.30 - 17.30,Transmission,"""Who is Watson?"" Documentary Screening and Q&A","We'll debut an exclusive screening of best-in-class B2B brand storytelling through the Transmission-produced short film, Who Is Watson? It showcases the enormous impact and influence of the CMO, who has shaped millions of lives around the world, often without their knowledge. The goal of this session is to uncover the marketing story and its leader that is worthy of sharing with the world.",Talk,https://app.boompop.com/events/RHFB9V/the-unofficial-home-for-b2b-at-cannes-lions-2025/guest-website,https://app.boompop.com/events/RHFB9V/the-unofficial-home-for-b2b-at-cannes-lions-2025/guest-website,"Le Speakeasy Cannes, 22 Rue Latour-Maubourg, 06400 Cannes",,,,,,,,,
16.30 - 18.30,Chase Media Solutions,RMN Holdco Frenemies Reception: Ascendant X Chase Media Solutions,Reception,Reception,https://www.chase.com/mediasolutions/resources/cannes-lions-2025?jp_cmp=of/cms/soc/linkedin/blog,https://www.chase.com/mediasolutions/resources/cannes-lions-2025?jp_cmp=of/cms/soc/linkedin/blog,Chase Media Solutions cabana on the Palais des Festivals,,,,,,,,,
17.00 - 17.30,IAS,Signal vs. Static: Standing Out in CTV,"As the CTV landscape explodes with content and inventory, how do buyers separate premium content from noise? This panel brings together voices from Publica by IAS, Philo, and PMG to unpack what buyers are truly looking for: granular data, brand-safe environments, and signals of premium value. Join us for honest takes on what’s needed to define true CTV success in 2025 and beyond.",Panel,https://connect.integralads.com/ias-cannes-2025,https://connect.integralads.com/ias-cannes-2025,"Sonishi Yacht, IGY Vieux-Port de Cannes
Jetée Albert Edouard
Cannes, France 06400",,,,,,,,,
17.00 - 17.30,Forbes ,2025 Forbes Top Creators List Launch Celebration - Refreshments & Networking,"This exclusive, invite-only event will feature must-see conversations with this year’s Top Creators, premium Forbes activations, refreshments and unparalleled networking with luminaries across the creator economy.",Refreshments & Networking,https://www.forbes.com/connect/event/2025-forbes-top-creators-list-launch-celebration/,https://www.forbes.com/connect/event/2025-forbes-top-creators-list-launch-celebration/,TBA,,,,,,,,,
17.00 - 19.00,DoubleVerify + Smartly,Happy Hour In Partnership With Smartly,"Raise a glass with DV and Smartly as we kick off an unforgettable week. Join brand and marketing leaders from around the world for a relaxed evening of great conversation while you sip on a refreshing glass of rosé (or two) after a busy day. Whether making new connections or deepening industry relationships, there’s no better place to unwind and get inspired.",Cruise,https://events.doubleverify.com/happyhour25-1,https://events.doubleverify.com/happyhour25-1,"DV Seven Sins Yacht, Jetée Albert Edouard",,,,,,,,,
17:00 - 19:00,Adweek,Adobe Sunset Series: Content Designed to Deliver + Happy Hour,"Marketers face growing pressure to keep content fresh, relevant, and personalized across every channel and format, all while driving business results. As content demands grow, marketers are challenged with delivering and optimizing at speed. Enter AI - helping teams move faster, iterate on the fly, and better understand what’s working. Hear from brands rethinking how they create and deliver content—modernizing their process with AI to power effective marketing that delivers impactful results.
Happy Hour to follow panel discussion!",Panel + Happy Hour,https://event.adweek.com/awh_cannes_2025/agenda,https://event.adweek.com/awh_cannes_2025/begin,"Le Majestic Hotel
10 Bd de la Croisette, 06400 Cannes",,,,,,,,,
