DATE + TIME,HOST ,EVENT NAME,DESCRIPTION,EVENT TYPE,URL LINK,RSVP,LOCATION,,,,,,,,,
15.25,Brand Innovators,How to Create Meaningful Brand Value: Deep Dive into Snapdragon's NEW Partnership with Surprise CEO Guest Speaker,"Julie Yamamoto, Senior Director, Marketing, Qualcomm

Moderated by: Ken Lagana, Global CRO, Media.net
",Talk,https://brand-innovators.com/events/marketing-leadership-summit-cannes-2025/,https://brand-innovators.com/events/marketing-leadership-summit-cannes-2025/,Showcase Stage,,,,,,,,,
15.30,Stagwell - SPORT BEACH,Drawing Up The Gameplan: Prepare Your Brand Experience to Scale with AI,Roundtable hosted by Code and Theory,Roundtable,https://www.sportbeach.com/schedule,https://www.sportbeach.com/schedule,"Boardroom, Sport Beach,  La Plage Du Festival at 52 Bd de la Croisette",,,,,,,,,
15.30,Omnicom,"Creative Inspiration:

McDonald's Curry Sauce","During the 2024 Paris Olympics, Team USA’s Steph Curry shattered France’s basketball dreams—and McDonald’s France fired back with flavor. DDB Paris made the lightning-fast call to pull Curry Sauce, turning national heartbreak into cultural gold. In this behind-the-scenes session, the team reveals how fan truth, timing, and fearless creative instincts turned a reactive idea into a viral sensation that lit up the internet and made the world take notice.",Talk,https://cannes.omc.com/creative-inspiration-curry-sauce,https://cannes.omc.com/creative-inspiration-curry-sauce,"Omnicom Space, Prom. Robert Favre le Bret
Cannes",,,,,,,,,
15.30,Canva,The Data Whisperers: The Secret Language of High-Performing CMOs,"Marketing executives share which metrics have transformed their decision-making. Learn how to turn data into engaging stories, build effective data systems, visualization tools, and craft insights that affect decisions.",Partnership Festival Experience / Official Events,https://public.canva.site/cannes#home,https://events.canva.com/cannes,Hôtel Martinez Beach,,,,,,,,,
15.30,Spectrum Reach,LIVE recording,"LIVE recording: Media Odyssey Podcast with Evan Shapiro, Media Cartographer & Marion Ranchet. Special Guests TBA",Podcast,https://experience.spectrumreach.com/cannes25,https://experience.spectrumreach.com/cannes25,"Spectrum Reach Suite at Apt 57
57 BD De La Croisette)",,,,,,,,,
15.30 - 16.00,Brand Innovators,Panel,"Shane Dwyer, Head of Sales, Lyft Media & Lyft Business, Lyft Media
Christine Martino, Chief Revenue Officer, Screenvision Media
Sarah Squiers, Executive Vice President, Client Partnerships, TelevisaUnivision
Moderated by: Jay Altshculer, SVP, Global Media & Agency Relations, Mastercard",Panel,https://brand-innovators.com/events/marketing-leadership-summit-cannes-2025/,https://brand-innovators.com/events/marketing-leadership-summit-cannes-2025/,Beach Stage,,,,,,,,,
15.30 - 16.00,The Female Quotient,Leveling the Playing Field: Male Leaders Advancing Women’s Sports,"Male executives are increasingly stepping up to champion the growth of women's sports—and recognizing the business opportunity it presents. As investment, visibility, and fan engagement around women’s sports reach new heights, these leaders are helping to accelerate the momentum by aligning their brands with female athletes, leagues, and stories. In this conversation, we’ll explore the cultural impact of women’s sports, the role brands can play in driving equity, and why supporting this movement is a smart strategy for long-term growth.",Conversation,https://events.thefemalequotient.com/canneslions25,https://events.thefemalequotient.com/canneslions25,"Hôtel Martinez – Suite 731
73 La Croisette
06400 Cannes",,,,,,,,,
15.30 - 16.00,The Washington Post,"""Impromptu"" Podcast Recording: Do You Want an AI Boyfriend?","Drew Goins, Co-Host of “Impromptu” & Newsletter Writer, The Washington Post
Bina Venkataraman, Editor-At-Large, Opinions Strategy & Innovation, The Washington Post",Talk,https://wpcannes2025.splashthat.com/,https://wpcannes2025.splashthat.com/,"The Washington Pst Lounge,  29 rue du Commandant André, Cannes",,,,,,,,,
15.30 - 16.15,Brands&Culture,"THE BRANDS&CULTURE DAY : FANDOMS, COMMUNITIES & NICHES ❤️","SONIC BOOM: WHY SOUND IS YOUR BRAND’S UNTAPPED SUPERPOWER. In a world oversaturated with visuals, sound remains the most under-leveraged but emotionally potent tool in a brand’s arsenal. This panel explores the transformative role of music in modern marketing—not as background noise, but as a strategic asset that drives brand storytelling, builds authentic communities, and fosters lasting consumer connections.",Panel,https://brandsnculture.com/cannes/,https://brandsnculture.com/cannes/,"Brands&Culture  VILLA, 13 Avenue de Benefiat, 06400",,,,,,,,,
15.30 - 17.00,Axios,Axios Live,"Winning the Hearts of Gen Z: How Brands Build Loyalty: With endless products flooding social feeds, it’s no wonder brands are finding it hard to connect with Gen Z. This generation craves more than convenience—they want connection, relevance, and reward. Loyalty programs, AI-driven personalization, and custom content are helping brands build deeper relationships and stand out in a crowded digital marketplace.
Join Axios in Cannes, France, for conversations with shopping influencers, brand experts and Gen Z marketing leaders on how foward-looking brands are building younger, loyal fanbases and revolutionizing the modern shopping experience.",Conversations,https://axioswinningtheheartsofgenzhow.splashthat.com/,https://axioswinningtheheartsofgenzhow.splashthat.com/,"The Mastercard Villa
3067 Bd des Horizons, 06220
Vallauris",,,,,,,,,
15.30 - 17.30,"Carat, dentsu",Carat Cultural Catalyst,"Join Carat at Cannes for live insight-fuelled inspiration, creator‑led conversations, cocktails, and beachside entertainment blending culture, media, and creativity into one unmissable experience.",Networking,https://caratcatalyst.splashthat.com/,https://caratcatalyst.splashthat.com/,"dentsu beach house, Hyde Beach, 45 Bd de la Croisette",,,,,,,,,
15.30 - 17.30,Horizon Media,Funnel to Frenzy,"Join us for From Funnel to Frenzy—a lively salon co-hosted with industry leaders exploring how AI is reshaping consumer discovery. Stick around after the panel for a garden happy hour with cocktails, connections, and a DJ set that keeps the energy going long after the conversation ends.",Panel,https://www.eventcreate.com/e/fromfunneltofrenzy,https://www.eventcreate.com/e/fromfunneltofrenzy,"Hotel Le Jardin Croisette, 7 Rue Molière, 06400 Cannes",,,,,,,,,
15.45 - 16.15,The Wall Street Journal,Journal House Cannes - A Conversation with Netflix CMO Marian Lee,"Netflix CMO Marian Lee joins Journal House Cannes to talk about the realities of marketing in today's competitive streaming landscape and share how she balances data insights with creative instinct to reach global audiences. She’ll also discuss fan-driven experiences and expanding Netflix’s brand into gaming and live events.  After the program, we invite you to enjoy your home away from home. Unwind with a coffee, connect with peers, and catch up on work.",Conversation,https://journalhouse.wsj.com/cannes-lions-festival-of-creativity/,https://journalhouse.wsj.com/cannes-lions-festival-of-creativity/,"61 Bd de la Croisette
Cannes",,,,,,,,,
15.45 - 16.15,DEPT® Secret Garden,AI Agents in Action: How Sainsbury’s is Reimagining Retail Media,"In this behind-the-scenes fireside chat hosted by Digiday, Sainsbury’s and DEPT® unpack how they’ve embedded AI agents into the core of Nectar360, Sainsbury’s retail media business. With over 100 campaigns and thousands of assets to manage each year, the team needed a faster, smarter way to handle asset compliance without compromising on quality. Their solution? A custom-built, multi-agent AI system that reviews logos, fonts, colors, objects, positioning, and T&Cs across static and video assets in under 20 seconds, with more than 90% accuracy. Unveiled by Sainsbury’s at Cannes, the platform is already reducing errors, cutting costs, and freeing up time for teams to focus on strategy and creativity. Join us to explore how AI agents are powering real change in retail media and why starting with practical, scalable solutions like this is the smartest way to move forward.

Alice Anson, Sainsbury’s
Isabel Perry, DEPT®
Host: Sara Jerde, Digiday",Panel,https://www.deptagency.com/event/join-dept-at-cannes-lions-2025/,https://www.deptagency.com/event/join-dept-at-cannes-lions-2025/,"3 Rdpt Duboys d’Angers, 06400 Cannes, France",,,,,,,,,
15.50 - 16.20,Brand Innovators,Fireside Chat,"Mark Kirkham, Chief Marketing Officer, PepsiCo Beverages US, PepsiCo

Moderated by: Katelyn Kroneman, Director, Advertiser Solutions, Snap",Fireside Chat,https://brand-innovators.com/events/marketing-leadership-summit-cannes-2025/,https://brand-innovators.com/events/marketing-leadership-summit-cannes-2025/,Showcase Stage,,,,,,,,,
16.00,Stagwell - SPORT BEACH,SPORT BEACH Open Play,Hosted by the NHL,Activity,https://www.sportbeach.com/schedule,https://www.sportbeach.com/schedule,"Court, Sport Beach,  La Plage Du Festival at 52 Bd de la Croisette",,,,,,,,,
16.00,Omnicom,"Fast Company

Press Hour","Fast Company’s Jeff Beer hosts a live power hour with Omnicom clients at the intersection of culture and creativity. From AI to entertainment, expect bold insights, sharp commentary, and stories shaping what’s next.​",Talk,https://cannes.omc.com/fast-company-press-hour,https://cannes.omc.com/fast-company-press-hour,"Omnicom Space, Prom. Robert Favre le Bret
Cannes",,,,,,,,,
16.00,Omnicom,Treat Me Like a Dog,"Cats get 32% fewer daily treats than dogs—and they’re not purring about it. Enter Treat Me Like a Dog, a bold new campaign from TEMPTATIONS™ Treats and Omnicom Commerce. Backed by shopper data and powered by OmniAI, the work uses humor and cultural insight to close the Treat Gap and grow the category. From smart sampling to AI-powered storytelling, this session breaks down how data, creativity, and technology came together to turn a furry injustice into a viral, commerce-building moment.​",Talk,https://cannes.omc.com/treat-me-like-a-dog,https://cannes.omc.com/treat-me-like-a-dog,"Omnicom Space, Prom. Robert Favre le Bret
Cannes",,,,,,,,,
16.00 - 16.30,Deep Blue Sports + Entertainment ,Women's Sports Yacht Club,"The Road to LA28 | Leaders & Visionaries
Break It Down

Sue Bird, WNBA Champion, Olympic Gold Medalist,
Co-Founder of A Touch More & TOGETHXR, Partner,
Deep Blue Sports + Entertainment
Dara Treseder, CMO, Autodesk
Julia Boorstin, Senior Media & Tech Correspondent, CNBC",Panel,https://tuesdayatthewsyc.splashthat.com/,https://tuesdayatthewsyc.splashthat.com/,"Maëma Beach
26 Boulevard Jean Hibert Azur Plage, 06400 Cannes",,,,,,,,,
16.00 - 16.30,The Female Quotient,CMO Daily Take by The FQ and Business Insider: Marketing’s Measurement Reckonin,"Marketing budgets are under a microscope. Proving ROI isn’t optional—it’s survival. But in a world of fragmented attention and shifting behaviors, how do CMOs measure what really matters? Join marketing leaders for a conversation about the new metrics shaping marketing investment, the opportunity AI presents, and how community-driven efforts can connect to real business outcomes.",Conversation,https://events.thefemalequotient.com/canneslions25,https://events.thefemalequotient.com/canneslions25,"Hôtel Martinez – Suite 731
73 La Croisette
06400 Cannes",,,,,,,,,
16:00 - 16.30,MediaLink,"Attention Wars: 
The Clout & Currency of Influencers","Who's in charge, the brand or the influencer? In this no-filter conversation, marketers and their attention-grabbing creators explore the wild world of influence, from playing it safe to letting things get really real. When clout becomes currency and creators become brands, the battle for eyeballs gets especially interesting.
Renaldo Chapman, Doordash, Aïda Moudachirou-Rébois, MAC Cosmetics, Najoh Tita-Reid, Mars Petcare, Jacqueline Tsekouras, #paid & Andrea Kerr Redniss, MediaLink & UTA",Conversations,https://www.medialinkbeach.com/,https://www.medialinkbeach.com/,"Checkpoint 3, Palais des Festivals La Croisette, Cannes",,,,,,,,,
16:00 - 16:45,Adweek - Group Chat Presented in Partnership With Inmar,Creative Contradictions: How Tension Fuels Innovation,"Hard times generate stronger leaders. Success isn’t about choosing sides—it’s about mastering the tension. Navigating the constant push and pull of modern business means doing more with less, moving fast while staying intentional, and balancing data with creative instinct.  This conversation brings together bold industry voices to break down the dynamic thinking, innovative tactics, and mindset shifts that are helping teams thrive in the perpetual pace of modern business. ",Chat,https://event.adweek.com/awh_cannes_2025/agenda,https://event.adweek.com/awh_cannes_2025/begin,"Le Majestic Hotel
10 Bd de la Croisette, 06400 Cannes",,,,,,,,,
16.00 - 17.00,Thinkbox & RTL Connect,Televisionaries in Cannes,"Leaders from Channel 4, ITV, Sky, and Disney will come together for a candid and thought-provoking discussion on the future of TV. ",Panel,https://www.thinkbox.tv/cannes,cannes@thinkbox.tv ,"RTL Beach, Boulevard de la Croisette",,,,,,,,,
16.00 - 17.00,Tubi,WTF is Creativity,"Join us for a discussion on the evolution of creativity and impact. Not everyone thinks they have the responsibility, or the opportunity, to be creative, but let’s open the aperture to incentivize and encourage people from all corners of business to bring fresh ideas to the table to drive innovation. ",Discussion,https://events.tubi.tv/tubicannes2025/linkedin_announcement,https://events.tubi.tv/tubicannes2025/linkedin_announcement,"Tubi Cabana • Checkpoint Entry #3
Palais Des Festivals, La Croisette",,,,,,,,,
16.00 - 17.00,Freewheel,"Measure, Create, Transform: CIMM’s Media Future Forum at Cannes","Explore the convergence of creativity, AI and measurement with CIMM. Through expert fireside chats and cross-industry dialogue, discover how collaboration is reshaping the future of global media.",Talk,https://www.freewheelcannes.com/#about,https://www.freewheelcannes.com/registration,"Freewheel Beach, Boulevard de la Croisette",,,,,,,,,
16.00 - 17.00,The SH COllective,AI for Good: Harnessing Artificial Intelligence for a better world,"AI isn’t just for profit—it can drive purpose. In this powerful session, discover how technologists and activists are building AI that serves humanity, promotes equity, and solves urgent, global problems. Be inspired by women using data and code for the collective good.",Panel,https://www.saloncultureconversations.com/,https://www.saloncultureconversations.com/,"Salon Culture Conversations Villa
384 Boulevard des Glaïeuls
06220 Vallauris",,,,,,,,,
16.00 - 17.30,VaynerX,CMO Circle: Real Talk on Retail Media,"Unlocking Media Solutions Potential
Join us for a raw, unfiltered conversation about what's actually working, what's next, and what's noise. With a curated group of CMOs and marketing leaders, we're covering the future of media strategies, the impact of emerging technologies, and how to drive measurable results in today's fast-paced media landscape.",Conversation,https://events.vaynerx.com/cmocircleunexpecteddataasset,https://events.vaynerx.com/cmocircleunexpecteddataasset,"
Chez Vayner Café, 2 Pl. du Général de Gaulle",,,,,,,,,
16.00 - 18.00,3C Ventures,Happy Hour,Join us for daily “Sunset Sips” hosted by Zeta Global,Happy Hour,https://plage3cv.com/,https://plage3cv.com/,"Lucia Beach Bd de la Croisette, Cannes, France 06400",,,,,,,,,
16.00 - 18.00,Snowflake,HAPPY HOUR & PANEL: THE POWER OF ALIGNMENT: BUILDING MORE THAN THE SUM OF THE PARTS,"Enjoy elevated cocktails, curated bites, and panoramic views as we kick off the evening with a dynamic panel discussion, The Power of Alignment: Building More Than the Sum of the Parts, featuring leaders from The Trade Desk, DoorDash Ads, and Hightouch as we pull back the curtain on one of the most pressing topics in marketing today: collaboration.",Happy Hour,https://www.snowflake.com/event/aboard-a-sunset-happy-hour/,https://www.snowflake.com/event/aboard-a-sunset-happy-hour/,"The location of Yacht will be across the Canopy Hilton Cannes, 2 Bd Jean Hibert.",,,,,,,,,
16.00 - 18.00,Little Black Book,Happy Hour Sponsored by LucidLink,Happy Hour,Happy Hour,https://lbbonline.com/news/the-lbb-and-friends-beach-cannes-content-programme-2025,https://lbbonline.com/news/the-lbb-and-friends-beach-cannes-content-programme-2025," LBB Beach , 65 Bd de la Croisette, 06400 Cannes",,,,,,,,,"
"
16.00 - 18.00,Wurl (an AppLovin company),Wurl Mixer & Social Hour,"Wurl Mixer & Social Hour - Open to all, stop by the cabana!",Networking,https://events.wurl.com/wurl-at-cannes-lions-2027,https://events.wurl.com/wurl-at-cannes-lions-2027,Wurl Cabana - Cabana #16 Checkpoint Entry #3,,,,,,,,,
16.00 - 18.00,Kantar,Creativity is business,"What makes a campaign stand out? For the fourth year, Kantar is partnering with the AACC and Media Figaro on the “Creativity is Business” initiative. Brand managers and creative directors will share insights into the performance of 10 campaigns created by French agencies and nominated for Cannes Lions. We introduce “Creativity for Change”, evaluating French campaigns nominated for various awards, aiming to inspire changes in consumer behavior that are more respectful of the planet and society. PRESENTATION IN FRENCH.",Conversations,https://www3.kantar.com/cannes-lions-2025/,https://www3.kantar.com/cannes-lions-2025/,"The Kantar Apartment
Rue de Serbes, 13
5th and 6th floor
Cannes",,,,,,,,,
16.00 - 18.00,Uber Advertising,Champions of Sports Culture,"An exploration into how the sports community is creating valuable connections to today’s audiences. What are opportunities to align with sports fans, a uniquely passionate and loyal consumer group? What are ways for athletes, teams, brands and media platforms to collaborate to best harness the power of sports to audiences broadly? Leaders across the sporting-verse converge to share how they are succeeding through sports fan engagement.
Speakers: Georgie Jeffreys, Head of Marketing US + Canada, Uber; Jordan Chiles, Olympic Gold Medalist, Gymnastics, and NYT Best-Selling Author; Tara Davis-Woodhall, Olympic Gold Medalist, Team USA Long Jumper; Tammy Henault, Chief Marketing Officer, NBA; Jess Ling, EVP Global Brand Advertising, American Express   &  Cynthia Littleton, Co-Editor-in-Chief, Variety (Moderator) ",Panel,https://uberatcannes2025.splashthat.com/?uclick_id=c28104e7-0d9c-40aa-9fee-e128dbbaed60,https://rsvp.zkipster.com/_nl5dg,"Uber Villa, 10 Rue Jean-Baptiste Dumas",,,,,,,,,
16.00 - 18.00,Amazon,Happy Hour,Happy Hour,Happy Hour,https://www.amazonadvertisingevents.com/amazonport2025/home,https://www.amazonadvertisingevents.com/amazonport2025/home,"Amazon Port - Cafe 
Esplanade Pantiero, Port de Cannes,
06400 Cannes",,,,,,,,,
16.00 - 18.00,Common Interest,An interview with Glenn Kitson,"Glenn Kitson is a cultural tour de force who has his feet firmly planted in both brand-land and in popular culture. As a highly sought after director, he works with some of the biggest names in music, lifestyle, fashion and performance sports. As a wry cultural commentator he's amassed a cult-like following of 200k+ people, and he LOVES a big coat (he was a stylist before he became a director).

CultureLab co-founder Jed Hallam will host this interview with Glenn, discussing brands in culture and subcultures built around brands.

Interview will start at 4:30pm CET. No late admissions.",Interview,https://www.eventbrite.co.uk/e/an-interview-with-glenn-kitson-tickets-1383932542489?aff=erelpanelorg,https://www.eventbrite.co.uk/e/an-interview-with-glenn-kitson-tickets-1383932542489?aff=erelpanelorg,23 Avenue Florida 06400 Canne,,,,,,,,,
16.00 - 18.30,Supernova,"Supernova PRIDE Summit, featuring Jess King Live DJ Set","Supernova is launching the first dedicated PRIDE Summit and Happy Hour at the Cannes Lions. This event will spark conversation with inspiring LGBTQ+ industry leaders and allies who are ushering in a new era of industry innovation and inclusion. Request an invite for an afternoon of networking, community, and charitable giving",Private Event (By Invitation Only),https://supernovapridesummit2025.splashthat.com/,https://supernovapridesummit2025.splashthat.com/,"Infillion Café, located at the Mondrian Cannes, 45 Bd de la Croisette, 06400 Cannes",,,,,,,,,
16.00 - 19.00,TripleLift,Happy Hour,"Client and partner happy hour, hosted at the TripleLift apartment",Happy Hour,https://tripleliftevents.com/happy-hour-cannes-2025/attendee,https://tripleliftevents.com/happy-hour-cannes-2025/attendee,"45 Bd de la Croisette, 7th Floor , Cannes",,,,,,,,,
16.00 - 19.00,Financial Times,Financial Times & People Like Us @ Cannes,"Join us for this special evening at Cannes focused on creative leadership, industry change, and the future of storytelling. Set against the backdrop of the world’s most influential advertising festival, this event will bring together brand leaders, creatives, and emerging talent for keynote interviews, dynamic showcases, and high-level networking — all designed to spark new ideas, partnerships, and pathways into the industry.",Networking,https://peoplelikeusatcannes.live.ft.com/home,https://peoplelikeusatcannes.live.ft.com/page/4930781/apply-to-attend-in-person,"Nikkei FT Anniversary Teahouse, 11 Rue des Belges, Cannes",,,,,,,,,
16.00 - 19.00,ExchangeWire & FirstPartyCapital,The Cannes Social 2025,"Join us at Ma Nolan's pub on Tuesday, June 17th for networking drinks from 4pm.",Networking & Drinks,https://events.exchangewire.com/CannesSocial25,https://events.exchangewire.com/CannesSocial25#/buyTickets/selectTickets?lang=en,"Ma Nolan's Irish Pub, 
6 Rue Buttura, 06400 Cannes",,,,,,,,,
16.00 - 19.00,Converge,Culture @ Cannes (Converge Bistro) (Sponsorship Available),"Tucked within an exclusive corner of Cannes, Converge @ Cannes hosts an unmissable gathering designed to celebrate and elevate the power of diversity at a time when it matters most. As conversations around inclusion face increasing resistance, this event creates space for bold, necessary dialogue—bringing together a dynamic mix of global leaders, brand innovators, and change agents who understand that real progress comes from authentic representation and diverse perspectives. Set against the elegant backdrop of the French Riviera, with an open bar and refined small bites inspired by the region, this evening is more than a social. Join us at The Converge Bistro to spark meaningful connections, challenge the status quo, and move the industry forward, together.",Networking,https://atconverge.com/cannes/,https://atconverge.com/cannes/,"Hotel Le Suquet, 5 Rue des Tambourinaires, Cannes",,,,,,,,,
16.00 - 19.00,Overline,Petanque & Plonk,"A relaxed afternoon of rosé, cocktails, and Côte d'Azur summer vibe. 
Rosé, pétanque & good company. Join Overline for a relaxed Cannes Lions soirée on June 17 — no decks, just drinks, and a little casual competition... it’s Pétanque & Plonk! ",Networking,https://overlineconsulting.com/insight/petanque-plonk/,Laura Paxton  lpaxton@overlineconsulting.com,"Les Allées de la Liberté Charles de Gaulle, Cannes",,,,,,,,,
16.05 - 16.30,Brand Innovators,Humanizing Brands In The Age Of AI,"Ravi Kandikonda, Senior Vice President, Marketing, Zillow

Paul Woolmington, Chief Executive Officer, Canvas Worldwide

Moderated by: Ali Manning, Co-Founder & COO, Chalice AI",Panel,https://brand-innovators.com/events/marketing-leadership-summit-cannes-2025/,https://brand-innovators.com/events/marketing-leadership-summit-cannes-2025/,Beach Stage,,,,,,,,,
16.15,Brands&Culture,"THE BRANDS&CULTURE DAY : FANDOMS, COMMUNITIES & NICHES ❤️","This session explores how Gen Z is reshaping the rules of engagement and what it takes for brands to stay culturally attuned, reputationally resilient, and in control of their narrative. Expect real-world insights, practical strategies, and a clearer path through today’s cultural minefield.",Panel,https://brandsnculture.com/cannes/,https://brandsnculture.com/cannes/,"Brands&Culture  VILLA, 13 Avenue de Benefiat, 06400",,,,,,,,,
16.15 - 16.45,TikTok,From Scroll to Shop,"Unbox how leading brands are finding their formula for growth through TikTok-first commerce strategies—with real-world, proven results and actionable tips.",Panel,https://tiktokatcannes.com/,https://tiktokatcannes.com/,"Carlton Hotel,  58 Bd de la Croisette Cs 40052, 06400",,,,,,,,,
16.15 - 17.00,Transmission,The CMO Language Divide with the Board and CFO,This candid session from the world's brightest CMOs and C-suite execs will discuss the very real challenges that CMOs face in communicating the value of long-term brand building to the board and CFO. We'll outline the differences in language and priorities between marketing and finance and how to bridge the gap and gain buy-in for brand-building initiatives.,Talk,https://app.boompop.com/events/RHFB9V/the-unofficial-home-for-b2b-at-cannes-lions-2025/guest-website,https://app.boompop.com/events/RHFB9V/the-unofficial-home-for-b2b-at-cannes-lions-2025/guest-website,"Le Speakeasy Cannes, 22 Rue Latour-Maubourg, 06400 Cannes",,,,,,,,,
