DATE + TIME,HOST ,EVENT NAME,DESCRIPTION,EVENT TYPE,URL LINK,RSVP,LOCATION,,,,,,,,,
Week-long venue,Cannes Lions,Cannes Lions Palais,"Discover the official content programme, from brands to agencies, inspirational talks to practical learnings. Check out the five Festival Content Streams: Trends and Insights, Innovation Unwrapped, The Creativity Toolbox, Talent and Cultures, Creative Impact.",Official events and awards (access via delegate pass),https://www.canneslions.com/festival/programme#/agenda,Official Palais programme accessible by pass holders only. Contact michaelaw@canneslions.com to discuss partnership opportunities,"Palais des Festivals et des Congrès, 1 Bd de la Croisette, 06400 Cannes, France",,,,,,,,,
Week-long venue,WACL & Propeller Group,WACL Empower Cafe 'Powered by Propeller' ,"Welcome back to the Empower Cafe at Cannes Lions — the inclusive, woman-centric hub for the creative, media, technology and advertising industries. ",Partnership Festival Experience / Official Events,https://events.propellergroup.com/,https://events.propellergroup.com/,"L'Avenue 1-5 Sq. Mérimée, 06400 Cannes",,,,,,,,,
Week-long venue,DEPT® Secret Garden,The DEPT® Secret Garden,"Where real conversations grow: 1300 sqm of space to breathe, meet, work, or just take five. Daily panels, a live podcast studio, AI-powered art, and some of the best coffee (and cocktails) in town.
Whether you’re into bold ideas or quiet moments, it’s all here—under the trees, on the terrace, in the thick of it and away from it all at the same time…",Partnership Festival Experience / Official Events,https://www.deptagency.com/event/join-dept-at-cannes-lions-2025/,https://www.deptagency.com/event/join-dept-at-cannes-lions-2025/,"3 Rdpt Duboys d’Angers, 06400 Cannes",,,,,,,,,
Week-long venue,Beet.TV,The Beet.TV Leadership Sessions at Cannes Lions,"Beet.TV will produce four full days of programming on topics including CTV and video streaming, retail and commerce media, data and measurement, and the power of AI.",Networking,https://events.beet.tv/cannes,https://events.beet.tv/cannes," Infillion Café, Mondrian Hotel, 45 Bd de la Croisette
Cannes",,,,,,,,,
Week-long venue,MSQ,Le Club MSQ,"
For Creative, Media and Tech Innovators who want to create momentum in Cannes",Networking,https://connect.msqpartners.com/le-club-msq-2025,https://connect.msqpartners.com/le-club-msq-2025,Varied,,,,,,,,,
Week-long venue,ADWEEK ,ADWEEK House at Cannes Lions:,"During Cannes Lions, ADWEEK House will explore how today’s most innovative minds are finding common ground and redefining the future by blending these opposing forces into something greater.",Partnership Festival Experience / Official Events,https://event.adweek.com/awh_cannes_2025,https://event.adweek.com/awh_cannes_2025/begin,"Le Majestic Hotel
10 Bd de la Croisette, 06400 Cannes",,,,,,,,,
Week-long venue,MediaLink,MediaLink Beach returns to Cannes Lions,"MediaLink, media and marketing’s most trusted advisor, returns to Cannes Lions this year with the latest iteration of our iconic MediaLink Beach. Bringing together the industry’s most compelling leaders and storytellers, MediaLink Beach is the hub at the festival for the industry’s C-suite to grow and transform their businesses. Join us June 16-19 for four days of practical conversation, inspired programming, and connections to culture in a convenient new location across from the main security checkpoint on the Croisette.",Networking,https://www.medialinkbeach.com/,https://www.medialinkbeach.com/,"Checkpoint 3, Palais des Festivals La Croisette, Cannes",,,,,,,,,
Week-long venue,Amazon,The House of Amazon at Amazon Port,Amazon is bringing our brands to the forefront at Cannes to show how you can connect with customers wherever they spend their time.,Partnership Festival Experience / Official Events,https://www.amazonadvertisingevents.com/amazonport2025/home,https://www.amazonadvertisingevents.com/amazonport2025/home,"Esplanade Pantiero Port de Cannes, 06400 Cannes",,,,,,,,,
Week-long venue,Campaign,"
Campaign HOUSE","Campaign has a home for the festival. Across three floors at the Hilton Canopy Hotel by the Old Port, we're bringing together our teams from Campaign UK, US, Canada, Asia Pacific, India, Indonesia and Germany in one space. 
We're hosting live interviews with the most recognisable names from the global advertising industry, partner activations, networking sessions, rooftop cocktail parties and much more.
Campaign House is open from Monday June 16 through to Friday June 20.  Come say hello.",Activities,https://www.campaignatcannes.com/about,https://www.campaignatcannes.com/about#,"Canopy by Hilton, 2 Bd jean Hibert, 06400",,,,,,,,,
Week-long venue,Freewheel,FreeWheel Beach,"We’ll showcase recent industry advances, predict what’s next in advertising, and soak up the sun on the French Riviera. Stop by to mix and mingle, attend a session, or have a one-on-one chat with a FreeWheel expert.",Partnership Festival Experience / Official Events,https://www.freewheelcannes.com/#about,https://www.freewheelcannes.com/registration,"Plage Goéland. Boulevard de la Croisette Cannes, 06400",,,,,,,,,
Week-long venue,Stagwell,SPORT BEACH,"SPORT BEACH returns to Cannes Lions for its third season from June 16th to June 19th, 2025 — bringing together athletes, marketers and global leaders to explore the intersection of sport, creativity and culture.",Partnership Festival Experience / Official Events,https://www.sportbeach.com/,https://www.sportbeach.com/register,La Plage Du Festival at 52 Bd de la Croisette,,,,,,,,,
Week-long venue,Quintal,Quintal of Brazilian,"Quintal is the gathering of Brazilians in Cannes. Let's meet, see each other, and do lots of networking",Networking,https://www.instagram.com/arrobaquintal/,https://www.instagram.com/arrobaquintal/,"72 Bd de la Croisette, 06400 Cannes",,,,,,,,,
12.00 - June 18 - 18.00,World Woman Foundation,WORLD WOMAN@CANNES LIONS,"On sidelines of Cannes Lions- exclusive two-day agenda designed for women advertisers, creators, storytellers shaping the creative economy.",Activities & Networking,https://www.eventbrite.com/e/world-womancannes-lions-tickets-1258607170929?aff=ebdssbdestsearch,https://www.eventbrite.com/e/world-womancannes-lions-tickets-1258607170929?aff=ebdssbdestsearch,"Hôtel Splendid Cannes, 4-6 Rue Félix Faure 06400 Canne",,,,,,,,,
Week-long venue,LWS,LWS at Cannes,"Join us for a strategic and delicious time at Cannes! We'll be hosting breakfasts and pre-party drinks at our Cannes apartment private patio. 
Spaces are extremely limited and preference will be given to existing LWS Members, agency friends, and friends of LWS. Strategy is what we do, so our gatherings are for strategists and strategy adjacent execs.",Breakfast & Networking,https://www.eventbrite.com/e/ladies-who-strategize-at-cannes-2025-tickets-1324435475159,https://lwsmembership.com/cannes-events-2025#page-0,"10 Av. Branly, Cannes",,,,,,,,,
Week-long venue,Kantar,"Your Creative Strategy, your team and you: empowered by AI",Join us at Cannes Lions 2025 to discover how AI can help you make your brand meaningfully different to more people.,Networking,https://www3.kantar.com/cannes-lions-2025/,https://www3.kantar.com/cannes-lions-2025/,"The Kantar Apartment, Rue de Serbes, 13, 5th and 6th floor, Cannes",,,,,,,,,
Week-long venue,The Wall Street Journal,Journal House Cannes,"As brands navigate an evolving media landscape, they are redefining success beyond traditional metrics. Join creatives, thought leaders and executives across industries at Journal House during the Cannes Lions Festival of Creativity to discuss how the convergence of storytelling, data and purpose can drive lasting impact and growth.",Partnership Festival Experience / Official Events,https://journalhouse.wsj.com/cannes-lions-festival-of-creativity/,https://journalhouse.wsj.com/cannes-lions-festival-of-creativity/,"61 Bd de la Croisette, Cannes",,,,,,,,,
Week-long venue,Ad Age,AD AGE IN CANNES,"Join Ad Age on the French Riviera from June 16 - 20, for a week of creativity, connection and conversation.",Networking,https://www.adageevents.com/event/cannes2025/summary,https://www.adageevents.com/event/cannes2025/summary,TBA,,,,,,,,,
Week-long venue,Equativ & Sharethrough,Equativ Yacht,"The Equativ and Sharethrough teams are gearing up for an unforgettable week at Cannes Lions, where big ideas, bold conversations, and sunny moments await. Ready to explore how our combined strengths can deliver better outcomes for your business? ",Networking,https://equativatcannes2025.com/,https://equativatcannes2025.com/,"Equativ Yacht, Harbor",,,,,,,,,
Week-long venue,tappx,Cannes Lions,"Cannes Lions is the premier event for the advertising and communications industry, showcasing the best work from around the globe. ",Networking,https://www.tappx.com/events/cannes-lions-2025,https://www.tappx.com/events/cannes-lions-2025,TBA,,,,,,,,,
Week-long venue,SAMBA TV,Samba Media Intelligence Lounge,"Join us for a week of inspiring conversations at the Samba Media Intelligence Lounge, thought leadership sessions, and VIP experiences!",Networking,https://www.samba.tv/business/events/cannes-2025,https://www.samba.tv/business/events/cannes-2025#RSVP,TBA,,,,,,,,,
Week-long venue,Pinterest,Pinterest Manifestival,"You step into the visual world of Pinterest brought to life.
Join us at the most unique destination in Cannes to explore the hottest trends and how your strategies can come alive. Oh, and The Original Pinterest Tattoo Parlour? Yep, it’s back—with a brand new twist.                                                                                        
 Monday: 10am-6pm
Tuesday and Wednesday: 9am-6pm
Thursday: 9am-5pm",Partnership Festival Experience / Official Events,https://pinterestcannes.com/,https://pinterestcannes.com/,"Carlton Beach Club, 58 Boulevard de la Croisette 06400, Cannes",,,,,,,,,
Week-long venue,RTL Beach,RTL Beach,"We look forward to welcoming you all week long from 9:00 AM to 6:00 PM for quality time during breakfast, lunch, and the golden hour, as we share unforgettable moments together.",Partnership Festival Experience / Official Events,https://rtl-adalliance.com/rtlbeach,https://rtl-adalliance.com/rtlbeach,"CBeach - 45 Boulevard de la Croisette, 06400",,,,,,,,,
Week-long venue,Ipsos,Ipsos at Cannes Lions 2025,"From Monday to Thursday join us on the beach for a series of talks, to relax at the Ipsos Lounge, or to have a drink and meet brands, agencies, and seasoned marketing and insights professionals.",Networking,https://www.ipsos.com/en-us/ipsos-cannes-lions-2025,https://www.ipsos.com/en-us/ipsos-cannes-lions-2025,"RTL Beach, CBeach - 45 Boulevard de la Croisette, 06400",,,,,,,,,
Week-long venue,Reddit,A Different Conversation,"This year at Cannes, visitors in our Reddit HQ will step into an interactive exhibit, allowing them to experience first-hand how brands tap into the power of conversations on Reddit. Conversations that drive decisions. Conversations that drive creativity. And ultimately, conversations that drive conversion. ",Networking,https://redditcannes2025.splashthat.com/,https://redditcannes2025.splashthat.com/,"Reddit HQ, Intersection of Prom. Robert Favre le Bret and Rue Buttura | Entry at Checkpoint 3, 06400",,,,,,,,,
Week-long venue,Magnite,Meet Magnite at Cannes,"Whether it’s a quick coffee on the Croisette, a seaside meeting on our yacht, or one of our exclusive events, we’d love to find time to meet.",Networking,https://event.magnite.com/cannes-2025,https://event.magnite.com/cannes-2025,"Magnite Yacht, Albert Edouard Jetty South
Cannes",,,,,,,,,
Week-long venue,GWI,GWI at Cannes Lions,"Whether you're looking to explore the latest in AI-powered consumer insights or want a face-to-face conversation about your next big move, we’ve got the space - and the spark - to make it happen.",Networking,https://www.gwi.com/cannes-lions,https://www.gwi.com/cannes-lions,"GWI HQ, The Carlton, Salon St Paul de Venice Space at the Carlton Hotel, 58 Bd de la Croisette Cs 40052, 06400 Cannes",,,,,,,,,
Week-long venue,GWI,GWI Spark Stadium,"This is where trustworthy insights come to life. Step inside our interactive GWI Spark experience at the Terrace at the Palais and explore how the speed of AI, paired with trusted research, can power your next big idea.",Activities,https://www.gwi.com/cannes-lions,https://www.gwi.com/cannes-lions,"GWI Spark Stadium, Terrasse Lérins, Palais des Festivals et des Congrès de Cannes, 1 Boulevard de la Croisette, 06400
Cannes",,,,,,,,,
Week-long venue,Nielsen,Nielsen at Cannes,"Join us all week on the Nielsen Terrace at Hotel Martinez, where we’ll host clients, partners and the advertising community. 
Get ready for a wave of exciting programming!",Networking,https://events.nielsen.com/nielsenatcannes2025,https://events.nielsen.com/nielsenatcannes2025,"Nielsen Terrace at Hotel Martinez,  73 Bd de la Croisette, 06400",,,,,,,,,
Week-long venue,Snowflake,Join Snowflake at Cannes Lions,Meet  the team. We’ll be hosting private customer meetings throughout the week at our beachfront Cabana and in a dedicated suite at Hotel Martinez—offering a relaxed setting for strategic conversations and meaningful connections.,Networking,https://www.snowflake.com/snowflake-at-cannes-lions-2025/,https://www.snowflake.com/snowflake-at-cannes-lions-2025/,Hotel Martinez & Beachfront Cabana,,,,,,,,,
Week-long venue,Brands&Culture,Brands&Culture in Cannes,"Last year, we launched with purpose—hosting everything from thought-provoking sessions to a private Michelin-star dinner, and unforgettable brand moments in one of the most coveted spots just steps from the Croisette. This year, Brands and Culture is back to push the conversation further, with sun-drenched programming, curated gatherings, and space to create, connect, and shape what’s next in culture.",Networking,https://brandsnculture.com/cannes/,https://brandsnculture.com/cannes/,"Brands&Culture  VILLA, 13 Avenue de Benefiat, 06400",,,,,,,,,
Week-long venue,InMobi,InMobi at Cannes,"Join us at Cannes Lions, the International Festival of Creativity!",Networking,https://go.inmobi.com/inmobi-cannes-lions-2025/,https://go.inmobi.com/inmobi-cannes-lions-2025/,"InMobi Café, La Cantina, 41 Rue Hoche, Cannes",,,,,,,,,
Week-long venue,CULTURE MIX,Culture Mix Cannes,"WHERE ART, DESIGN, BOOKS, FASHION, MUSIC, FOOD & MIXOLOGY COLLIDE.  We are a movement dedicated to fostering creativity, innovation, and inclusivity in every facet of our endeavors.",Networking,https://www.culturemix.org/,https://www.culturemix.org/,"Annex Beach, Bd de la Croisette, 06400",,,,,,,,,
Week-long venue,Paramount Advertising,Paramount Advertising at Cannes,Celebrate creativity and innovation on the French Riviera with Paramount Advertising. ,Networking,https://events.paramount.com/cannes-2025,https://events.paramount.com/cannes-2025,TBA,,,,,,,,,
Week-long venue,72Point,Connect in Cannes 2025,"If you’re heading to Cannes Lions this year, make sure to stop by the 72Point Group PR Pop-Up on the Little Black Book Beach. We’re creating a space where creativity, connection, and a bit of calm come together. Whether you’re looking to brainstorm, network, or just take a breather, we’d love to see you. ",Networking,https://info.72point.com/cannes2025,https://info.72point.com/cannes2025,"LBB Beach , 65 Bd de la Croisette, 06400 Cannes",,,,,,,,,
Week-long venue,Global Advertising Lawyers Alliance - GALA,Cannes 2025,,Networking,https://tinyurl.com/galacannes2025,https://tinyurl.com/galacannes2025,"La French Connexion - Croisette Beach Hotel, 13 Rue du Canada, Cannes",,,,,,,,,
Week-long venue,TikTok,TikTok at Cannes 2025,"Heading to Cannes this year? TikTok's bringing the heat to the Carlton again, and we're holding space just for you.
 From expert talks to can't-miss happy hours, and a few 'only on TikTok' surprises, sign up now to gain exclusive access to it all.",Networking,https://tiktokatcannes.com/,https://tiktokatcannes.com/,"Carlton Hotel,  58 Bd de la Croisette Cs 40052, 06400",,,,,,,,,
Week-long venue,The Female Quotient,FQ LOUNGE@ cannes lions,"Please join us in the FQ Lounge™ @ Cannes Lions, where we’ll spark game-changing conversations, challenge outdated narratives, and set the “Cannes”-do standard for visibility, representation, and impact in media, marketing, and beyond. ",Partnership Festival Experience / Official Events,https://events.thefemalequotient.com/canneslions25,https://events.thefemalequotient.com/canneslions25,"Hôtel Martinez – Suite 731, 73 La Croisette, 06400 Cannes",,,,,,,,,
Week-long venue,Little Black Book,LBB & Friends Beach 2025,"Join us at La Plage Croisette Beach for five unforgettable days of networking, inspiration, and industry insights during the Cannes Lions Festival of Creativity from June 16th to 20th",Activities,https://beach.lbbonline.com/2025,https://beach.lbbonline.com/2025,"LBB Beach , 65 Bd de la Croisette, 06400 Cannes",,,,,,,,,
Week-long venue,WPP,WPP at Cannes Lions 2025,"Join us at Cannes Lions 2025 to explore the latest advancements in AI, participate in hands-on workshops, and connect with industry leaders, peers and potential partners. From inspiring sessions to exclusive networking events, we're bringing together the brightest minds in the industry at the WPP Beach and WPP Rooftop. Discover actionable insights, forge valuable connections and unlock new opportunities.",Networking,https://www.wppatcannes2025.com/event/b54177a9-d829-4222-b322-c6c5a9a592fe/summary,https://www.wppatcannes2025.com/event/b54177a9-d829-4222-b322-c6c5a9a592fe/summary,WPP Beach,,,,,,,,,
Week-long venue,Captiv8,"Creators,
Culture and
Relevance","By popular demand, we’re bringing together top CMOs in our exclusive Carlton suite for epic connections with our creators and Captiv8 experts. It’s the perfect opportunity to network, collaborate, and get inspired. We’re talking exclusive GRWMs, nightly dinners, and a chance to join forces with some of the most innovative minds in the industry.",Networking,https://sites.captiv8.io/cannes-2025,https://sites.captiv8.io/cannes-2025,"The Carlton,  58 Bd de la Croisette Cs 40052, 06400",,,,,,,,,
Week-long venue,VideoWeek,VideoWeek in Cannes 2025,"VideoWeek will be filming all the latest news and views on the ground  in Cannes from the 16th to the 20th June, producing a video series featuring the industry’s leading movers and shakers in AI in media & marketing.",Networking,https://videoweek.com/videoweek-in-cannes/,https://videoweek.com/videoweek-in-cannes/,TBA,,,,,,,,,
Week-long venue,AdTonos,A Sound Advantage Sunset Cruise,"Join us for an exclusive sunset experience aboard a luxurious Bali 4.6 three-deck catamaran during the Cannes Lions Festival. It’s the perfect way to relax, chill, and decompress after a full day of meetings – all while taking in the stunning views of the French Riviera.",Cruise,https://www.adtonos.com/cannes-lions-2025-sunset-cruise/,https://www.adtonos.com/cannes-lions-2025-sunset-cruise/,Daily guest pickup from Cannes IGY Vieux-Port marina to our anchored catamaran just off La Croisette beach (unless the cruise plan states otherwise),,,,,,,,,
Week-long venue,DoubleVerify,Set Sail for Innovation: Join DV at Cannes,"For an ad-supported Internet to thrive, digital marketing must be impactful for brands, sustainable for publishers and respectful of consumer privacy and choice. At Cannes Lions 2025, DV will explore how AI-powered innovations are transforming the media landscape for brands and publishers alike, powering unprecedented campaign efficiency and performance.",Yacht,https://events.doubleverify.com/dvatcannes2025,https://events.doubleverify.com/dvatcannes2025,"DV Seven Sins Yacht, Jetée Albert Edouard",,,,,,,,,
Week-long venue,Basis Technologies,The Grand Basis Oasis,"Say ""bonjour"" to The Grand Basis Oasis, your five-star retreat to relax, refresh, and recharge during Cannes Lions. Stop by for a quick drink, or stay a while and enjoy thoughtful conversations and meaningful connections. Check in any time. Stay as long as you like.",Networking,https://basis.com/the-grand-basis-oasis,https://basis.com/the-grand-basis-oasis,"4 Rue des Serbes, Rèsidence Gray d'Albion, Cannes",,,,,,,,,
Week-long venue,Brand Innovators,Marketing Leadership Summit @ Cannes,"Back for our 11th year at Cannes Lions, Brand Innovators is making our biggest splash yet—with three stunning venues and a dynamic, powerful lineup of the top speakers in our industry. Between Plage Rado Beach, the exclusive LVMH villa, and the iconic Armani Caffè, this activation is our most ambitious and high-impact yet, designed to deliver unparalleled access, conversation, and connection at the center of the creative marketing universe. Expect A-list CMOs, global brand leaders, and the world’s most influential marketers from the world’s most innovative brands sharing the insights and ideas shaping the future of creativity.",Networking,https://brand-innovators.com/events/marketing-leadership-summit-cannes-2025/,https://brand-innovators.com/events/marketing-leadership-summit-cannes-2025/,"Rado Plage, Bd de la Croisette, 06400 Cannes",,,,,,,,,
Week-long venue,The Marketing Society,Cannes 2025 Spotlight,Join The Marketing Society at a series of events at Cannes,Networking,https://marketingsociety.com/think-piece/cannes-2025-spotlight,https://marketingsociety.com/think-piece/cannes-2025-spotlight,Various,,,,,,,,,
Week-long venue,Known,Escape to the Known Villa,"We’ll be hosting conversations, cocktails, and moments of connection throughout the week. 
Let us know if you’ll be in town.",Networking,https://bit.ly/4d7LJM3,https://bit.ly/4d7LJM3,TBA,,,,,,,,,
Week-long venue,SiriusXM Media & AdsWizz,Join us on the Croisette!,"Returning for a third year, SiriusXM Media and AdsWizz’s waterfront cabana, located on cabana row, will be a prime location as we host impactful meetings, intimate thought leadership sessions and workshops, along with networking opportunities.",Networking,https://siriusxmmedia-adswizz-cannes25.splashthat.com/,https://siriusxmmedia-adswizz-cannes25.splashthat.com/,TBA,,,,,,,,,
Week-long venue,OpenAP,Experience Cannes with OpenAP,We’re coming together with partners across the video ecosystem to demonstrate the power of an audience-first approach to advertising and toasting to the progress in making premium video advertising simpler and more powerful. Take a look at where you can find us at Cannes Lions 2025 and request an invitation to join the innovators and change-makers transforming video advertising as we gather in the French Riviera.,Networking,https://www.openap.tv/cannes-2025,https://www.openap.tv/cannes-2025,TBA,,,,,,,,,
Week-long venue,Braze,Meet with Braze at Cannes Lions 2025,"AI can do a lot of great things–write emails, newsletters, or even website copy, like this–but AI still can’t show up for your meetings.",Networking,https://brazeevents.braze.com/cannes-meeting-2025,https://brazeevents.braze.com/cannes-meeting-2025,"Cabana Row, Palace of Festivals, 1 Boulevard de la Croisette, Cannes ",,,,,,,,,
Week-long venue,Experian,The Experian Suite,"This Cannes Lions, we’re rolling out the red carpet for smarter advertising. Join us at the Experian Suite for a VIP experience where strategy meets execution.",Networking,https://emsevents.experian.com/experianatcannes2025/Social,https://emsevents.experian.com/experianatcannes2025/Social,"The Experian Suite at the Gray d’Albion
4 Rue des Serbes ",,,,,,,,,
Week-long venue,IAS ,Connect with IAS ,"Join IAS as we host a curated lineup of  educational panels, intimate meetings and networking opportunities designed to bring together visionary minds from the digital media landscape.",Networking,https://connect.integralads.com/ias-cannes-2025,https://connect.integralads.com/ias-cannes-2025,"Sonishi Yacht, IGY Vieux-Port de Cannes, Jetée Albert Edouard, Cannes, France 06400",,,,,,,,,
Week-long venue,Smartly,POWER BETTER ADS AT CANNES,"Smartly is back at Cannes Lions bringing together trailblazing brand leaders, visionary advertisers, and the creative minds driving the convergence of social, commerce, technology, and storytelling. ",Networking,https://www.smartlyevents.com/event/cannes2025/agenda,https://www.smartlyevents.com/event/cannes2025/agenda,Smartly Penthouse ,,,,,,,,,
Week-long venue,Business Insider,Business Insider C-Suite,"Business Insider will be hosting marketing leaders in our suite at First Croisette, for a week of intimate roundtable discussions, CMO Insider video interviews, and top-to-top meetings. From June 16 - June 20, 09.00 - 17.00",Networking,https://advertising.businessinsider.com/cannes-2025,https://advertising.businessinsider.com/cannes-2025,First Croisette,,,,,,,,,
Week-long venue,Colins + Vast,Collins House 2025,"If you’ll be in Cannes this June, and if you’d rather be in an 1855 chateau in a garden up among the hills, a few minutes from the Carlton Hotel – talking with your peers, builders, skeptics and stubborn optimists … you may want to find your way to COLLINS House. It’s a gathering of those shaping the next chapter of our professions – quietly, rigorously, deliberately, all together.",Networking,https://www.linkedin.com/posts/briancollins3_a-week-ago-we-did-it-again-we-opened-the-activity-7323716544788656128-rCRx/?rcm=ACoAAAzSaXkBfyXFDiDPgJH4w6cHEJaLnYw2PiM,https://lu.ma/w5ld0gka,TBA,,,,,,,,,
